20:06:47.488350 IP 192.168.3.219.55441 > 239.255.255.250.1900: UDP, length 117
20:06:50.796082 IP ec2-54-243-75-14.compute-1.amazonaws.com.8883 > 192.168.3.219.58026: Flags [P.], seq 2288492897:2288493286, ack 3192148, win 62267, length 389
20:06:50.841141 IP 192.168.3.219.58026 > ec2-54-243-75-14.compute-1.amazonaws.com.8883: Flags [P.], seq 1:70, ack 389, win 1477, length 69
20:06:50.903804 IP ec2-54-243-75-14.compute-1.amazonaws.com.8883 > 192.168.3.219.58026: Flags [.], ack 70, win 62267, length 0
20:06:50.906250 IP 192.168.3.219.58026 > ec2-54-243-75-14.compute-1.amazonaws.com.8883: Flags [P.], seq 70:427, ack 389, win 1477, length 357
20:06:50.917981 IP ec2-54-243-75-14.compute-1.amazonaws.com.8883 > 192.168.3.219.58026: Flags [.], ack 427, win 64021, length 0
20:06:50.932963 IP ec2-54-243-75-14.compute-1.amazonaws.com.8883 > 192.168.3.219.58026: Flags [P.], seq 389:458, ack 427, win 64021, length 69
20:06:51.003083 IP 192.168.3.219.58026 > ec2-54-243-75-14.compute-1.amazonaws.com.8883: Flags [.], ack 458, win 2920, length 0
20:06:51.031130 IP 192.168.3.219.58026 > ec2-54-243-75-14.compute-1.amazonaws.com.8883: Flags [P.], seq 427:848, ack 458, win 2920, length 421
20:06:51.065385 IP ec2-54-243-75-14.compute-1.amazonaws.com.8883 > 192.168.3.219.58026: Flags [P.], seq 458:527, ack 848, win 65535, length 69
20:06:51.105676 IP 192.168.3.219.58026 > ec2-54-243-75-14.compute-1.amazonaws.com.8883: Flags [.], ack 527, win 2851, length 0
20:06:55.872601 ARP, Request who-has 192.168.3.219 tell OpenWrt.lan, length 28
20:06:55.875991 ARP, Reply 192.168.3.219 is-at d8:ec:5e:34:5b:fc (oui Unknown), length 28
20:07:03.240119 IP 192.168.3.219.58548 > OpenWrt.lan.53: 16994+ A? 3.linksys.pool.ntp.org. (40)
20:07:03.252380 IP OpenWrt.lan.53 > 192.168.3.219.58548: 16994 4/0/0 A 107.194.210.155, A 44.190.6.254, A 23.94.219.121, A 45.79.109.111 (104)
20:07:03.254782 IP 192.168.3.219.58034 > 107-194-210-155.lightspeed.lsvlky.sbcglobal.net.123: NTPv4, Client, length 48
20:07:03.295087 IP 107-194-210-155.lightspeed.lsvlky.sbcglobal.net.123 > 192.168.3.219.58034: NTPv4, Server, length 48
20:07:14.657584 IP 192.168.3.219.17850 > OpenWrt.lan.53: 43015+ A? www.belkin.com. (32)
20:07:14.670521 IP OpenWrt.lan.53 > 192.168.3.219.17850: 43015 5/0/0 CNAME dco4srg0kvrex.cloudfront.net., A 54.239.174.91, A 54.239.174.27, A 54.239.174.79, A 54.239.174.13 (138)
20:07:14.673049 IP 192.168.3.219 > server-54-239-174-91.ord53.r.cloudfront.net: ICMP echo request, id 52651, seq 1, length 128
20:07:14.712064 IP server-54-239-174-91.ord53.r.cloudfront.net > 192.168.3.219: ICMP echo reply, id 52651, seq 1, length 128
20:07:16.990217 IP 192.168.3.219.55441 > 239.255.255.250.1900: UDP, length 294
20:07:21.034342 IP 192.168.3.219.58026 > ec2-54-243-75-14.compute-1.amazonaws.com.8883: Flags [P.], seq 848:917, ack 527, win 2851, length 69
20:07:21.049551 IP ec2-54-243-75-14.compute-1.amazonaws.com.8883 > 192.168.3.219.58026: Flags [P.], seq 527:596, ack 917, win 65535, length 69
20:07:21.105927 IP 192.168.3.219.58026 > ec2-54-243-75-14.compute-1.amazonaws.com.8883: Flags [.], ack 596, win 2782, length 0
20:07:23.972073 IP ec2-54-243-75-14.compute-1.amazonaws.com.8883 > 192.168.3.219.58026: Flags [P.], seq 596:985, ack 917, win 65535, length 389
20:07:24.038297 IP 192.168.3.219.58026 > ec2-54-243-75-14.compute-1.amazonaws.com.8883: Flags [P.], seq 917:986, ack 985, win 2393, length 69
20:07:24.106002 IP ec2-54-243-75-14.compute-1.amazonaws.com.8883 > 192.168.3.219.58026: Flags [.], ack 986, win 65535, length 0
20:07:24.108729 IP 192.168.3.219.58026 > ec2-54-243-75-14.compute-1.amazonaws.com.8883: Flags [P.], seq 986:1343, ack 985, win 2393, length 357
20:07:24.139112 IP ec2-54-243-75-14.compute-1.amazonaws.com.8883 > 192.168.3.219.58026: Flags [.], ack 1343, win 65535, length 0
20:07:24.152653 IP ec2-54-243-75-14.compute-1.amazonaws.com.8883 > 192.168.3.219.58026: Flags [P.], seq 985:1054, ack 1343, win 65535, length 69
20:07:24.230474 IP 192.168.3.219.58026 > ec2-54-243-75-14.compute-1.amazonaws.com.8883: Flags [P.], seq 1343:1764, ack 1054, win 2324, length 421
20:07:24.277755 IP ec2-54-243-75-14.compute-1.amazonaws.com.8883 > 192.168.3.219.58026: Flags [P.], seq 1054:1123, ack 1764, win 65535, length 69
20:07:24.356232 IP 192.168.3.219.58026 > ec2-54-243-75-14.compute-1.amazonaws.com.8883: Flags [.], ack 1123, win 2255, length 0
20:07:26.080626 ARP, Request who-has 192.168.3.219 tell OpenWrt.lan, length 28
20:07:26.087493 ARP, Reply 192.168.3.219 is-at d8:ec:5e:34:5b:fc (oui Unknown), length 28
20:07:47.809830 IP 192.168.3.219.55441 > 239.255.255.250.1900: UDP, length 117
20:07:54.247667 IP 192.168.3.219.58026 > ec2-54-243-75-14.compute-1.amazonaws.com.8883: Flags [P.], seq 1764:1833, ack 1123, win 2255, length 69
20:07:54.262654 IP ec2-54-243-75-14.compute-1.amazonaws.com.8883 > 192.168.3.219.58026: Flags [P.], seq 1123:1192, ack 1833, win 65535, length 69
20:07:54.370458 IP 192.168.3.219.58026 > ec2-54-243-75-14.compute-1.amazonaws.com.8883: Flags [.], ack 1192, win 2186, length 0
20:07:59.360666 ARP, Request who-has 192.168.3.219 tell OpenWrt.lan, length 28
20:07:59.363684 ARP, Reply 192.168.3.219 is-at d8:ec:5e:34:5b:fc (oui Unknown), length 28
20:08:17.657891 IP ec2-54-243-75-14.compute-1.amazonaws.com.8883 > 192.168.3.219.58026: Flags [P.], seq 1192:1581, ack 1833, win 65535, length 389
20:08:17.754035 IP 192.168.3.219.58026 > ec2-54-243-75-14.compute-1.amazonaws.com.8883: Flags [P.], seq 1833:1902, ack 1581, win 1797, length 69
20:08:17.807740 IP ec2-54-243-75-14.compute-1.amazonaws.com.8883 > 192.168.3.219.58026: Flags [.], ack 1902, win 65535, length 0
20:08:17.811267 IP 192.168.3.219.58026 > ec2-54-243-75-14.compute-1.amazonaws.com.8883: Flags [P.], seq 1902:2259, ack 1581, win 1797, length 357
20:08:17.824596 IP ec2-54-243-75-14.compute-1.amazonaws.com.8883 > 192.168.3.219.58026: Flags [.], ack 2259, win 65535, length 0
20:08:17.839554 IP ec2-54-243-75-14.compute-1.amazonaws.com.8883 > 192.168.3.219.58026: Flags [P.], seq 1581:1650, ack 2259, win 65535, length 69
20:08:17.893038 IP 192.168.3.219.58026 > ec2-54-243-75-14.compute-1.amazonaws.com.8883: Flags [.], ack 1650, win 1728, length 0
20:08:17.944091 IP 192.168.3.219.58026 > ec2-54-243-75-14.compute-1.amazonaws.com.8883: Flags [P.], seq 2259:2680, ack 1650, win 1728, length 421
20:08:17.980629 IP ec2-54-243-75-14.compute-1.amazonaws.com.8883 > 192.168.3.219.58026: Flags [P.], seq 1650:1719, ack 2680, win 65535, length 69
20:08:18.143848 IP 192.168.3.219.58026 > ec2-54-243-75-14.compute-1.amazonaws.com.8883: Flags [.], ack 1719, win 1659, length 0
20:08:47.949495 IP 192.168.3.219.58026 > ec2-54-243-75-14.compute-1.amazonaws.com.8883: Flags [P.], seq 2680:2749, ack 1719, win 1659, length 69
20:08:48.006700 IP ec2-54-243-75-14.compute-1.amazonaws.com.8883 > 192.168.3.219.58026: Flags [.], ack 2749, win 65535, length 0
20:08:48.050285 IP ec2-54-243-75-14.compute-1.amazonaws.com.8883 > 192.168.3.219.58026: Flags [P.], seq 1719:1788, ack 2749, win 65535, length 69
20:08:48.105711 IP 192.168.3.219.55441 > 239.255.255.250.1900: UDP, length 117
20:08:48.144935 IP 192.168.3.219.58026 > ec2-54-243-75-14.compute-1.amazonaws.com.8883: Flags [.], ack 1788, win 1590, length 0
20:08:53.120600 ARP, Request who-has 192.168.3.219 tell OpenWrt.lan, length 28
20:08:53.128040 ARP, Reply 192.168.3.219 is-at d8:ec:5e:34:5b:fc (oui Unknown), length 28
20:08:58.189700 IP ec2-54-243-75-14.compute-1.amazonaws.com.8883 > 192.168.3.219.58026: Flags [P.], seq 1788:2177, ack 2749, win 65535, length 389
20:08:58.267041 IP 192.168.3.219.58026 > ec2-54-243-75-14.compute-1.amazonaws.com.8883: Flags [.], ack 2177, win 2920, length 0
20:08:58.267042 IP 192.168.3.219.58026 > ec2-54-243-75-14.compute-1.amazonaws.com.8883: Flags [P.], seq 2749:2818, ack 2177, win 2920, length 69
20:08:58.286418 IP ec2-54-243-75-14.compute-1.amazonaws.com.8883 > 192.168.3.219.58026: Flags [.], ack 2818, win 65535, length 0
20:08:58.291617 IP 192.168.3.219.58026 > ec2-54-243-75-14.compute-1.amazonaws.com.8883: Flags [P.], seq 2818:3175, ack 2177, win 2920, length 357
20:08:58.305943 IP ec2-54-243-75-14.compute-1.amazonaws.com.8883 > 192.168.3.219.58026: Flags [.], ack 3175, win 65535, length 0
20:08:58.319991 IP ec2-54-243-75-14.compute-1.amazonaws.com.8883 > 192.168.3.219.58026: Flags [P.], seq 2177:2246, ack 3175, win 65535, length 69
20:08:58.395538 IP 192.168.3.219.58026 > ec2-54-243-75-14.compute-1.amazonaws.com.8883: Flags [.], ack 2246, win 2851, length 0
20:08:58.441019 IP 192.168.3.219.58026 > ec2-54-243-75-14.compute-1.amazonaws.com.8883: Flags [P.], seq 3175:3596, ack 2246, win 2851, length 421
20:08:58.489069 IP ec2-54-243-75-14.compute-1.amazonaws.com.8883 > 192.168.3.219.58026: Flags [P.], seq 2246:2315, ack 3596, win 65535, length 69
20:08:58.646420 IP 192.168.3.219.58026 > ec2-54-243-75-14.compute-1.amazonaws.com.8883: Flags [.], ack 2315, win 2782, length 0
20:09:02.294153 IP ec2-54-243-75-14.compute-1.amazonaws.com.8883 > 192.168.3.219.58026: Flags [P.], seq 2315:2704, ack 3596, win 65535, length 389
20:09:02.347510 IP 192.168.3.219.58026 > ec2-54-243-75-14.compute-1.amazonaws.com.8883: Flags [P.], seq 3596:3665, ack 2704, win 2393, length 69
20:09:02.403960 IP ec2-54-243-75-14.compute-1.amazonaws.com.8883 > 192.168.3.219.58026: Flags [.], ack 3665, win 65535, length 0
20:09:02.409678 IP 192.168.3.219.58026 > ec2-54-243-75-14.compute-1.amazonaws.com.8883: Flags [P.], seq 3665:4022, ack 2704, win 2393, length 357
20:09:02.422808 IP ec2-54-243-75-14.compute-1.amazonaws.com.8883 > 192.168.3.219.58026: Flags [.], ack 4022, win 65535, length 0
20:09:02.439814 IP ec2-54-243-75-14.compute-1.amazonaws.com.8883 > 192.168.3.219.58026: Flags [P.], seq 2704:2773, ack 4022, win 65535, length 69
20:09:02.489697 IP 192.168.3.219.58026 > ec2-54-243-75-14.compute-1.amazonaws.com.8883: Flags [P.], seq 4022:4443, ack 2773, win 2324, length 421
20:09:02.528388 IP ec2-54-243-75-14.compute-1.amazonaws.com.8883 > 192.168.3.219.58026: Flags [P.], seq 2773:2842, ack 4443, win 65535, length 69
20:09:02.653177 IP 192.168.3.219.58026 > ec2-54-243-75-14.compute-1.amazonaws.com.8883: Flags [.], ack 2842, win 2255, length 0
20:09:20.907420 IP 192.168.3.219.55441 > 239.255.255.250.1900: UDP, length 294
20:09:32.494262 IP 192.168.3.219.58026 > ec2-54-243-75-14.compute-1.amazonaws.com.8883: Flags [P.], seq 4443:4512, ack 2842, win 2255, length 69
20:09:32.509699 IP ec2-54-243-75-14.compute-1.amazonaws.com.8883 > 192.168.3.219.58026: Flags [P.], seq 2842:2911, ack 4512, win 65535, length 69
20:09:32.646773 IP 192.168.3.219.58026 > ec2-54-243-75-14.compute-1.amazonaws.com.8883: Flags [.], ack 2911, win 2186, length 0
20:09:37.664636 ARP, Request who-has 192.168.3.219 tell OpenWrt.lan, length 28
20:09:37.667768 ARP, Reply 192.168.3.219 is-at d8:ec:5e:34:5b:fc (oui Unknown), length 28
20:09:41.395288 IP ec2-54-243-75-14.compute-1.amazonaws.com.8883 > 192.168.3.219.58026: Flags [P.], seq 2911:3300, ack 4512, win 65535, length 389
20:09:41.497239 IP 192.168.3.219.58026 > ec2-54-243-75-14.compute-1.amazonaws.com.8883: Flags [P.], seq 4512:4581, ack 3300, win 1797, length 69
20:09:41.556620 IP ec2-54-243-75-14.compute-1.amazonaws.com.8883 > 192.168.3.219.58026: Flags [.], ack 4581, win 65535, length 0
20:09:41.559987 IP 192.168.3.219.58026 > ec2-54-243-75-14.compute-1.amazonaws.com.8883: Flags [P.], seq 4581:4938, ack 3300, win 1797, length 357
20:09:41.572542 IP ec2-54-243-75-14.compute-1.amazonaws.com.8883 > 192.168.3.219.58026: Flags [.], ack 4938, win 65535, length 0
20:09:41.589362 IP ec2-54-243-75-14.compute-1.amazonaws.com.8883 > 192.168.3.219.58026: Flags [P.], seq 3300:3369, ack 4938, win 65535, length 69
20:09:41.646121 IP 192.168.3.219.58026 > ec2-54-243-75-14.compute-1.amazonaws.com.8883: Flags [.], ack 3369, win 1728, length 0
20:09:41.670721 IP 192.168.3.219.58026 > ec2-54-243-75-14.compute-1.amazonaws.com.8883: Flags [P.], seq 4938:5359, ack 3369, win 1728, length 421
20:09:41.706333 IP ec2-54-243-75-14.compute-1.amazonaws.com.8883 > 192.168.3.219.58026: Flags [P.], seq 3369:3438, ack 5359, win 65535, length 69
20:09:41.896966 IP 192.168.3.219.58026 > ec2-54-243-75-14.compute-1.amazonaws.com.8883: Flags [.], ack 3438, win 1659, length 0
20:09:48.407816 IP 192.168.3.219.55441 > 239.255.255.250.1900: UDP, length 117
20:10:11.687282 IP 192.168.3.219.58026 > ec2-54-243-75-14.compute-1.amazonaws.com.8883: Flags [P.], seq 5359:5428, ack 3438, win 1659, length 69
20:10:11.703808 IP ec2-54-243-75-14.compute-1.amazonaws.com.8883 > 192.168.3.219.58026: Flags [P.], seq 3438:3507, ack 5428, win 65535, length 69
20:10:11.911277 IP 192.168.3.219.58026 > ec2-54-243-75-14.compute-1.amazonaws.com.8883: Flags [.], ack 3507, win 1590, length 0
20:10:14.790908 IP 192.168.3.219.7086 > OpenWrt.lan.53: 63425+ A? www.belkin.com. (32)
20:10:14.804629 IP OpenWrt.lan.53 > 192.168.3.219.7086: 63425 5/0/0 CNAME dco4srg0kvrex.cloudfront.net., A 54.239.174.13, A 54.239.174.91, A 54.239.174.27, A 54.239.174.79 (138)
20:10:14.807224 IP 192.168.3.219 > server-54-239-174-13.ord53.r.cloudfront.net: ICMP echo request, id 52651, seq 1, length 128
20:10:14.842222 IP server-54-239-174-13.ord53.r.cloudfront.net > 192.168.3.219: ICMP echo reply, id 52651, seq 1, length 128
20:10:16.832645 ARP, Request who-has 192.168.3.219 tell OpenWrt.lan, length 28
20:10:16.834675 ARP, Reply 192.168.3.219 is-at d8:ec:5e:34:5b:fc (oui Unknown), length 28
20:10:30.958491 IP ec2-54-243-75-14.compute-1.amazonaws.com.8883 > 192.168.3.219.58026: Flags [P.], seq 3507:3896, ack 5428, win 65535, length 389
20:10:30.988651 IP 192.168.3.219.58026 > ec2-54-243-75-14.compute-1.amazonaws.com.8883: Flags [.], ack 3896, win 2920, length 0
20:10:30.994527 IP 192.168.3.219.58026 > ec2-54-243-75-14.compute-1.amazonaws.com.8883: Flags [P.], seq 5428:5497, ack 3896, win 2920, length 69
20:10:31.061808 IP ec2-54-243-75-14.compute-1.amazonaws.com.8883 > 192.168.3.219.58026: Flags [.], ack 5497, win 65535, length 0
20:10:31.064396 IP 192.168.3.219.58026 > ec2-54-243-75-14.compute-1.amazonaws.com.8883: Flags [P.], seq 5497:5854, ack 3896, win 2920, length 357
20:10:31.098080 IP ec2-54-243-75-14.compute-1.amazonaws.com.8883 > 192.168.3.219.58026: Flags [.], ack 5854, win 65535, length 0
20:10:31.098583 IP ec2-54-243-75-14.compute-1.amazonaws.com.8883 > 192.168.3.219.58026: Flags [P.], seq 3896:3965, ack 5854, win 65535, length 69
20:10:31.160734 IP 192.168.3.219.58026 > ec2-54-243-75-14.compute-1.amazonaws.com.8883: Flags [.], ack 3965, win 2851, length 0
20:10:31.169018 IP 192.168.3.219.58026 > ec2-54-243-75-14.compute-1.amazonaws.com.8883: Flags [P.], seq 5854:6275, ack 3965, win 2851, length 421
20:10:31.202994 IP ec2-54-243-75-14.compute-1.amazonaws.com.8883 > 192.168.3.219.58026: Flags [P.], seq 3965:4034, ack 6275, win 65535, length 69
20:10:31.410697 IP 192.168.3.219.58026 > ec2-54-243-75-14.compute-1.amazonaws.com.8883: Flags [.], ack 4034, win 2782, length 0
20:10:32.669652 IP ec2-54-243-75-14.compute-1.amazonaws.com.8883 > 192.168.3.219.58026: Flags [P.], seq 4034:4423, ack 6275, win 65535, length 389
20:10:32.677181 IP 192.168.3.219.58026 > ec2-54-243-75-14.compute-1.amazonaws.com.8883: Flags [P.], seq 6275:6344, ack 4423, win 2393, length 69
20:10:32.731403 IP ec2-54-243-75-14.compute-1.amazonaws.com.8883 > 192.168.3.219.58026: Flags [.], ack 6344, win 65535, length 0
20:10:32.740809 IP 192.168.3.219.58026 > ec2-54-243-75-14.compute-1.amazonaws.com.8883: Flags [P.], seq 6344:6701, ack 4423, win 2393, length 357
20:10:32.753190 IP ec2-54-243-75-14.compute-1.amazonaws.com.8883 > 192.168.3.219.58026: Flags [.], ack 6701, win 65535, length 0
20:10:32.776661 IP ec2-54-243-75-14.compute-1.amazonaws.com.8883 > 192.168.3.219.58026: Flags [P.], seq 4423:4492, ack 6701, win 65535, length 69
20:10:32.818959 IP 192.168.3.219.58026 > ec2-54-243-75-14.compute-1.amazonaws.com.8883: Flags [P.], seq 6701:7122, ack 4492, win 2324, length 421
20:10:32.848673 IP ec2-54-243-75-14.compute-1.amazonaws.com.8883 > 192.168.3.219.58026: Flags [P.], seq 4492:4561, ack 7122, win 65535, length 69
20:10:32.911508 IP 192.168.3.219.58026 > ec2-54-243-75-14.compute-1.amazonaws.com.8883: Flags [.], ack 4561, win 2255, length 0
20:10:48.724475 IP 192.168.3.219.55441 > 239.255.255.250.1900: UDP, length 117
20:11:02.821937 IP 192.168.3.219.58026 > ec2-54-243-75-14.compute-1.amazonaws.com.8883: Flags [P.], seq 7122:7191, ack 4561, win 2255, length 69
20:11:02.837097 IP ec2-54-243-75-14.compute-1.amazonaws.com.8883 > 192.168.3.219.58026: Flags [P.], seq 4561:4630, ack 7191, win 65535, length 69
20:11:02.911790 IP 192.168.3.219.58026 > ec2-54-243-75-14.compute-1.amazonaws.com.8883: Flags [.], ack 4630, win 2186, length 0
20:11:08.032637 ARP, Request who-has 192.168.3.219 tell OpenWrt.lan, length 28
20:11:08.034673 ARP, Reply 192.168.3.219 is-at d8:ec:5e:34:5b:fc (oui Unknown), length 28
20:11:24.825970 IP 192.168.3.219.55441 > 239.255.255.250.1900: UDP, length 294
20:11:32.924276 IP 192.168.3.219.58026 > ec2-54-243-75-14.compute-1.amazonaws.com.8883: Flags [P.], seq 7191:7260, ack 4630, win 2186, length 69
20:11:32.941674 IP ec2-54-243-75-14.compute-1.amazonaws.com.8883 > 192.168.3.219.58026: Flags [P.], seq 4630:4699, ack 7260, win 65535, length 69
20:11:33.162280 IP 192.168.3.219.58026 > ec2-54-243-75-14.compute-1.amazonaws.com.8883: Flags [.], ack 4699, win 2117, length 0
20:11:48.274456 IP ec2-54-243-75-14.compute-1.amazonaws.com.8883 > 192.168.3.219.58026: Flags [P.], seq 4699:5088, ack 7260, win 65535, length 389
20:11:48.328742 IP 192.168.3.219.58026 > ec2-54-243-75-14.compute-1.amazonaws.com.8883: Flags [P.], seq 7260:7329, ack 5088, win 1728, length 69
20:11:48.384315 IP ec2-54-243-75-14.compute-1.amazonaws.com.8883 > 192.168.3.219.58026: Flags [.], ack 7329, win 65535, length 0
20:11:48.392123 IP 192.168.3.219.58026 > ec2-54-243-75-14.compute-1.amazonaws.com.8883: Flags [P.], seq 7329:7686, ack 5088, win 1728, length 357
20:11:48.404778 IP ec2-54-243-75-14.compute-1.amazonaws.com.8883 > 192.168.3.219.58026: Flags [.], ack 7686, win 65535, length 0
20:11:48.426200 IP ec2-54-243-75-14.compute-1.amazonaws.com.8883 > 192.168.3.219.58026: Flags [P.], seq 5088:5157, ack 7686, win 65535, length 69
20:11:48.500887 IP 192.168.3.219.58026 > ec2-54-243-75-14.compute-1.amazonaws.com.8883: Flags [P.], seq 7686:8107, ack 5157, win 1659, length 421
20:11:48.537336 IP ec2-54-243-75-14.compute-1.amazonaws.com.8883 > 192.168.3.219.58026: Flags [P.], seq 5157:5226, ack 8107, win 65535, length 69
20:11:48.664536 IP 192.168.3.219.58026 > ec2-54-243-75-14.compute-1.amazonaws.com.8883: Flags [.], ack 5226, win 1590, length 0
20:11:49.030105 IP 192.168.3.219.55441 > 239.255.255.250.1900: UDP, length 117
20:11:53.344735 ARP, Request who-has 192.168.3.219 tell OpenWrt.lan, length 28
20:11:53.346968 ARP, Reply 192.168.3.219 is-at d8:ec:5e:34:5b:fc (oui Unknown), length 28
20:12:18.521939 IP 192.168.3.219.58026 > ec2-54-243-75-14.compute-1.amazonaws.com.8883: Flags [P.], seq 8107:8176, ack 5226, win 1590, length 69
20:12:18.538252 IP ec2-54-243-75-14.compute-1.amazonaws.com.8883 > 192.168.3.219.58026: Flags [P.], seq 5226:5295, ack 8176, win 65535, length 69
20:12:18.678908 IP 192.168.3.219.58026 > ec2-54-243-75-14.compute-1.amazonaws.com.8883: Flags [.], ack 5295, win 1521, length 0
20:12:48.621642 IP 192.168.3.219.58026 > ec2-54-243-75-14.compute-1.amazonaws.com.8883: Flags [P.], seq 8176:8245, ack 5295, win 1521, length 69
20:12:48.636612 IP ec2-54-243-75-14.compute-1.amazonaws.com.8883 > 192.168.3.219.58026: Flags [P.], seq 5295:5364, ack 8245, win 65535, length 69
20:12:48.679270 IP 192.168.3.219.58026 > ec2-54-243-75-14.compute-1.amazonaws.com.8883: Flags [.], ack 5364, win 1452, length 0
20:12:48.721066 IP 192.168.3.219.58026 > ec2-54-243-75-14.compute-1.amazonaws.com.8883: Flags [.], ack 5364, win 2920, length 0
20:12:49.344048 IP 192.168.3.219.55441 > 239.255.255.250.1900: UDP, length 117
20:12:53.760664 ARP, Request who-has 192.168.3.219 tell OpenWrt.lan, length 28
20:12:53.762839 ARP, Reply 192.168.3.219 is-at d8:ec:5e:34:5b:fc (oui Unknown), length 28
20:13:14.885391 IP 192.168.3.219.45958 > OpenWrt.lan.53: 39378+ A? www.belkin.com. (32)
20:13:14.900541 IP OpenWrt.lan.53 > 192.168.3.219.45958: 39378 5/0/0 CNAME dco4srg0kvrex.cloudfront.net., A 54.239.174.27, A 54.239.174.79, A 54.239.174.13, A 54.239.174.91 (138)
20:13:14.902965 IP 192.168.3.219 > server-54-239-174-27.ord53.r.cloudfront.net: ICMP echo request, id 52651, seq 1, length 128
20:13:14.936187 IP server-54-239-174-27.ord53.r.cloudfront.net > 192.168.3.219: ICMP echo reply, id 52651, seq 1, length 128
20:13:18.723832 IP 192.168.3.219.58026 > ec2-54-243-75-14.compute-1.amazonaws.com.8883: Flags [P.], seq 8245:8314, ack 5364, win 2920, length 69
20:13:18.740003 IP ec2-54-243-75-14.compute-1.amazonaws.com.8883 > 192.168.3.219.58026: Flags [P.], seq 5364:5433, ack 8314, win 65535, length 69
20:13:18.933258 IP 192.168.3.219.58026 > ec2-54-243-75-14.compute-1.amazonaws.com.8883: Flags [.], ack 5433, win 2851, length 0
20:13:28.745886 IP 192.168.3.219.55441 > 239.255.255.250.1900: UDP, length 294
20:13:33.017693 IP ec2-54-243-75-14.compute-1.amazonaws.com.8883 > 192.168.3.219.58026: Flags [P.], seq 5433:5822, ack 8314, win 65535, length 389
20:13:33.029611 IP 192.168.3.219.58026 > ec2-54-243-75-14.compute-1.amazonaws.com.8883: Flags [P.], seq 8314:8383, ack 5822, win 2462, length 69
20:13:33.087501 IP ec2-54-243-75-14.compute-1.amazonaws.com.8883 > 192.168.3.219.58026: Flags [.], ack 8383, win 65535, length 0
20:13:33.091048 IP 192.168.3.219.58026 > ec2-54-243-75-14.compute-1.amazonaws.com.8883: Flags [P.], seq 8383:8740, ack 5822, win 2462, length 357
20:13:33.103677 IP ec2-54-243-75-14.compute-1.amazonaws.com.8883 > 192.168.3.219.58026: Flags [.], ack 8740, win 65535, length 0
20:13:33.133818 IP ec2-54-243-75-14.compute-1.amazonaws.com.8883 > 192.168.3.219.58026: Flags [P.], seq 5822:5891, ack 8740, win 65535, length 69
20:13:33.180252 IP 192.168.3.219.58026 > ec2-54-243-75-14.compute-1.amazonaws.com.8883: Flags [.], ack 5891, win 2393, length 0
20:13:33.203796 IP 192.168.3.219.58026 > ec2-54-243-75-14.compute-1.amazonaws.com.8883: Flags [P.], seq 8740:9161, ack 5891, win 2393, length 421
20:13:33.245614 IP ec2-54-243-75-14.compute-1.amazonaws.com.8883 > 192.168.3.219.58026: Flags [P.], seq 5891:5960, ack 9161, win 65535, length 69
20:13:33.430176 IP 192.168.3.219.58026 > ec2-54-243-75-14.compute-1.amazonaws.com.8883: Flags [.], ack 5960, win 2324, length 0
20:13:38.048634 ARP, Request who-has 192.168.3.219 tell OpenWrt.lan, length 28
20:13:38.051005 ARP, Reply 192.168.3.219 is-at d8:ec:5e:34:5b:fc (oui Unknown), length 28
20:13:49.659052 IP 192.168.3.219.55441 > 239.255.255.250.1900: UDP, length 117
20:14:03.218490 IP 192.168.3.219.58026 > ec2-54-243-75-14.compute-1.amazonaws.com.8883: Flags [P.], seq 9161:9230, ack 5960, win 2324, length 69
20:14:03.238835 IP ec2-54-243-75-14.compute-1.amazonaws.com.8883 > 192.168.3.219.58026: Flags [P.], seq 5960:6029, ack 9230, win 65535, length 69
20:14:03.444608 IP 192.168.3.219.58026 > ec2-54-243-75-14.compute-1.amazonaws.com.8883: Flags [.], ack 6029, win 2255, length 0
20:14:33.321836 IP 192.168.3.219.58026 > ec2-54-243-75-14.compute-1.amazonaws.com.8883: Flags [P.], seq 9230:9299, ack 6029, win 2255, length 69
20:14:33.340788 IP ec2-54-243-75-14.compute-1.amazonaws.com.8883 > 192.168.3.219.58026: Flags [P.], seq 6029:6098, ack 9299, win 65535, length 69
20:14:33.444960 IP 192.168.3.219.58026 > ec2-54-243-75-14.compute-1.amazonaws.com.8883: Flags [.], ack 6098, win 2186, length 0
20:14:36.830445 IP ec2-54-243-75-14.compute-1.amazonaws.com.8883 > 192.168.3.219.58026: Flags [P.], seq 6098:6487, ack 9299, win 65535, length 389
20:14:36.926078 IP 192.168.3.219.58026 > ec2-54-243-75-14.compute-1.amazonaws.com.8883: Flags [P.], seq 9299:9368, ack 6487, win 1797, length 69
20:14:36.983176 IP ec2-54-243-75-14.compute-1.amazonaws.com.8883 > 192.168.3.219.58026: Flags [.], ack 9368, win 65535, length 0
20:14:36.990379 IP 192.168.3.219.58026 > ec2-54-243-75-14.compute-1.amazonaws.com.8883: Flags [P.], seq 9368:9725, ack 6487, win 1797, length 357