19:00:57.361403 IP OpenWrt.lan.22 > taport-ThinkPad-T540p.lan.42354: Flags [P.], seq 4116535761:4116535877, ack 3890182876, win 8010, options [nop,nop,TS val 1099056744 ecr 1094733094], length 116
19:00:57.361916 IP taport-ThinkPad-T540p.lan.42354 > OpenWrt.lan.22: Flags [.], ack 116, win 501, options [nop,nop,TS val 1094733111 ecr 1099056744], length 0
19:00:57.362162 IP 192.168.3.247.65132 > ecs-119-8-230-166.compute.hwclouds-dns.com.26378: UDP, length 107
19:00:57.366683 IP OpenWrt.lan.22 > taport-ThinkPad-T540p.lan.42354: Flags [P.], seq 116:232, ack 1, win 8010, options [nop,nop,TS val 1099056750 ecr 1094733111], length 116
19:00:57.367235 IP taport-ThinkPad-T540p.lan.42354 > OpenWrt.lan.22: Flags [.], ack 232, win 501, options [nop,nop,TS val 1094733116 ecr 1099056750], length 0
19:00:57.394914 IP 192.168.3.247.65132 > ecs-119-8-230-166.compute.hwclouds-dns.com.26378: UDP, length 87
19:00:57.396141 IP ecs-119-8-230-166.compute.hwclouds-dns.com.26378 > 192.168.3.247.65132: UDP, length 143
19:00:57.430350 IP 1d.e8.39a9.ip4.static.sl-reverse.com.20002 > 192.168.3.247.60443: UDP, length 155
19:00:57.436237 IP 192.168.3.247.65132 > ecs-119-8-230-166.compute.hwclouds-dns.com.26378: UDP, length 91
19:00:57.451472 IP ecs-119-8-230-166.compute.hwclouds-dns.com.26378 > 192.168.3.247.65132: UDP, length 118
19:00:57.461720 IP 192.168.3.247.65132 > ecs-119-8-230-166.compute.hwclouds-dns.com.26378: UDP, length 87
19:00:57.496302 IP 192.168.3.247.65132 > ecs-119-8-230-166.compute.hwclouds-dns.com.26378: UDP, length 91
19:00:57.507027 IP ecs-119-8-230-166.compute.hwclouds-dns.com.26378 > 192.168.3.247.65132: UDP, length 126
19:00:57.531504 IP 192.168.3.247.65132 > ecs-119-8-230-166.compute.hwclouds-dns.com.26378: UDP, length 92
19:00:57.562512 IP ecs-119-8-230-166.compute.hwclouds-dns.com.26378 > 192.168.3.247.65132: UDP, length 96
19:00:57.568396 IP 192.168.3.247.65132 > ecs-119-8-230-166.compute.hwclouds-dns.com.26378: UDP, length 85
19:00:57.595127 IP 192.168.3.247.65132 > ecs-119-8-230-166.compute.hwclouds-dns.com.26378: UDP, length 89
19:00:57.618581 IP ecs-119-8-230-166.compute.hwclouds-dns.com.26378 > 192.168.3.247.65132: UDP, length 183
19:00:57.628954 IP 192.168.3.247.65132 > ecs-119-8-230-166.compute.hwclouds-dns.com.26378: UDP, length 92
19:00:57.662198 IP 192.168.3.247.65132 > ecs-119-8-230-166.compute.hwclouds-dns.com.26378: UDP, length 85
19:00:57.673913 IP ecs-119-8-230-166.compute.hwclouds-dns.com.26378 > 192.168.3.247.65132: UDP, length 131
19:00:57.695568 IP 192.168.3.247.65132 > ecs-119-8-230-166.compute.hwclouds-dns.com.26378: UDP, length 101
19:00:57.728303 IP 192.168.3.247.65132 > ecs-119-8-230-166.compute.hwclouds-dns.com.26378: UDP, length 85
19:00:57.729616 IP ecs-119-8-230-166.compute.hwclouds-dns.com.26378 > 192.168.3.247.65132: UDP, length 138
19:00:57.762071 IP 192.168.3.247.65132 > ecs-119-8-230-166.compute.hwclouds-dns.com.26378: UDP, length 119
19:00:57.785134 IP ecs-119-8-230-166.compute.hwclouds-dns.com.26378 > 192.168.3.247.65132: UDP, length 80
19:00:57.788387 IP 192.168.3.247.60443 > 1d.e8.39a9.ip4.static.sl-reverse.com.20002: UDP, length 61
19:00:57.795073 IP 192.168.3.247.65132 > ecs-119-8-230-166.compute.hwclouds-dns.com.26378: UDP, length 92
19:00:57.828381 IP 192.168.3.247.65132 > ecs-119-8-230-166.compute.hwclouds-dns.com.26378: UDP, length 85
19:00:57.840762 IP ecs-119-8-230-166.compute.hwclouds-dns.com.26378 > 192.168.3.247.65132: UDP, length 123
19:00:57.864150 IP 192.168.3.247.65132 > ecs-119-8-230-166.compute.hwclouds-dns.com.26378: UDP, length 89
19:00:57.896281 IP ecs-119-8-230-166.compute.hwclouds-dns.com.26378 > 192.168.3.247.65132: UDP, length 92
19:00:57.897276 IP 192.168.3.247.65132 > ecs-119-8-230-166.compute.hwclouds-dns.com.26378: UDP, length 85
19:00:57.929866 IP 192.168.3.247.65132 > ecs-119-8-230-166.compute.hwclouds-dns.com.26378: UDP, length 89
19:00:57.945276 IP 1d.e8.39a9.ip4.static.sl-reverse.com.20002 > 192.168.3.247.60443: UDP, length 42
19:00:57.952233 IP ecs-119-8-230-166.compute.hwclouds-dns.com.26378 > 192.168.3.247.65132: UDP, length 162
19:00:57.961902 IP 192.168.3.247.65132 > ecs-119-8-230-166.compute.hwclouds-dns.com.26378: UDP, length 121
19:00:57.995089 IP 192.168.3.247.65132 > ecs-119-8-230-166.compute.hwclouds-dns.com.26378: UDP, length 85
19:00:58.007496 IP ecs-119-8-230-166.compute.hwclouds-dns.com.26378 > 192.168.3.247.65132: UDP, length 80
19:00:58.030064 IP 192.168.3.247.65132 > ecs-119-8-230-166.compute.hwclouds-dns.com.26378: UDP, length 89
19:00:58.061666 IP 192.168.3.247.65132 > ecs-119-8-230-166.compute.hwclouds-dns.com.26378: UDP, length 85
19:00:58.063211 IP ecs-119-8-230-166.compute.hwclouds-dns.com.26378 > 192.168.3.247.65132: UDP, length 135
19:00:58.096634 IP 192.168.3.247.65132 > ecs-119-8-230-166.compute.hwclouds-dns.com.26378: UDP, length 89
19:00:58.118791 IP ecs-119-8-230-166.compute.hwclouds-dns.com.26378 > 192.168.3.247.65132: UDP, length 80
19:00:58.132829 IP 192.168.3.247.65132 > ecs-119-8-230-166.compute.hwclouds-dns.com.26378: UDP, length 92
19:00:58.167656 IP 192.168.3.247.65132 > ecs-119-8-230-166.compute.hwclouds-dns.com.26378: UDP, length 85
19:00:58.174603 IP ecs-119-8-230-166.compute.hwclouds-dns.com.26378 > 192.168.3.247.65132: UDP, length 124
19:00:58.196057 IP 192.168.3.247.65132 > ecs-119-8-230-166.compute.hwclouds-dns.com.26378: UDP, length 82
19:00:58.229890 IP 192.168.3.247.65132 > ecs-119-8-230-166.compute.hwclouds-dns.com.26378: UDP, length 89
19:00:58.230177 IP ecs-119-8-230-166.compute.hwclouds-dns.com.26378 > 192.168.3.247.65132: UDP, length 111
19:00:58.263779 IP 192.168.3.247.65132 > ecs-119-8-230-166.compute.hwclouds-dns.com.26378: UDP, length 92
19:00:58.285821 IP ecs-119-8-230-166.compute.hwclouds-dns.com.26378 > 192.168.3.247.65132: UDP, length 123
19:00:58.295395 IP 192.168.3.247.65132 > ecs-119-8-230-166.compute.hwclouds-dns.com.26378: UDP, length 92
19:00:58.328452 IP 192.168.3.247.65132 > ecs-119-8-230-166.compute.hwclouds-dns.com.26378: UDP, length 85
19:00:58.341327 IP ecs-119-8-230-166.compute.hwclouds-dns.com.26378 > 192.168.3.247.65132: UDP, length 95
19:00:58.362117 IP 192.168.3.247.65132 > ecs-119-8-230-166.compute.hwclouds-dns.com.26378: UDP, length 105
19:00:58.395906 IP 192.168.3.247.65132 > ecs-119-8-230-166.compute.hwclouds-dns.com.26378: UDP, length 85
19:00:58.396973 IP ecs-119-8-230-166.compute.hwclouds-dns.com.26378 > 192.168.3.247.65132: UDP, length 123
19:00:58.428765 IP 192.168.3.247.65132 > ecs-119-8-230-166.compute.hwclouds-dns.com.26378: UDP, length 89
19:00:58.452688 IP ecs-119-8-230-166.compute.hwclouds-dns.com.26378 > 192.168.3.247.65132: UDP, length 209
19:00:58.470745 IP 192.168.3.247.65132 > ecs-119-8-230-166.compute.hwclouds-dns.com.26378: UDP, length 85
19:00:58.497237 IP 192.168.3.247.65132 > ecs-119-8-230-166.compute.hwclouds-dns.com.26378: UDP, length 89
19:00:58.508460 IP ecs-119-8-230-166.compute.hwclouds-dns.com.26378 > 192.168.3.247.65132: UDP, length 124
19:00:58.528796 IP 192.168.3.247.65132 > ecs-119-8-230-166.compute.hwclouds-dns.com.26378: UDP, length 92
19:00:58.562089 IP 192.168.3.247.65132 > ecs-119-8-230-166.compute.hwclouds-dns.com.26378: UDP, length 85
19:00:58.563742 IP ecs-119-8-230-166.compute.hwclouds-dns.com.26378 > 192.168.3.247.65132: UDP, length 83
19:00:58.599352 IP 192.168.3.247.65132 > ecs-119-8-230-166.compute.hwclouds-dns.com.26378: UDP, length 89
19:00:58.619697 IP ecs-119-8-230-166.compute.hwclouds-dns.com.26378 > 192.168.3.247.65132: UDP, length 166
19:00:58.630128 IP 192.168.3.247.65132 > ecs-119-8-230-166.compute.hwclouds-dns.com.26378: UDP, length 92
19:00:58.661964 IP 192.168.3.247.65132 > ecs-119-8-230-166.compute.hwclouds-dns.com.26378: UDP, length 85
19:00:58.675391 IP ecs-119-8-230-166.compute.hwclouds-dns.com.26378 > 192.168.3.247.65132: UDP, length 92
19:00:58.696544 IP 192.168.3.247.65132 > ecs-119-8-230-166.compute.hwclouds-dns.com.26378: UDP, length 101
19:00:58.731071 IP ecs-119-8-230-166.compute.hwclouds-dns.com.26378 > 192.168.3.247.65132: UDP, length 157
19:00:58.732163 IP 192.168.3.247.65132 > ecs-119-8-230-166.compute.hwclouds-dns.com.26378: UDP, length 85
19:00:58.767119 IP 192.168.3.247.61392 > 49.51.180.215.17000: UDP, length 5
19:00:58.767120 IP 192.168.3.247.65132 > ecs-119-8-230-166.compute.hwclouds-dns.com.26378: UDP, length 89
19:00:58.785718 IP 192.168.3.247.60443 > 1d.e8.39a9.ip4.static.sl-reverse.com.20002: UDP, length 61
19:00:58.786240 IP ecs-119-8-230-166.compute.hwclouds-dns.com.26378 > 192.168.3.247.65132: UDP, length 80
19:00:58.795448 IP 192.168.3.247.65132 > ecs-119-8-230-166.compute.hwclouds-dns.com.26378: UDP, length 92
19:00:58.829526 IP 192.168.3.247.65132 > ecs-119-8-230-166.compute.hwclouds-dns.com.26378: UDP, length 85
19:00:58.839240 IP 49.51.180.215.17000 > 192.168.3.247.61392: UDP, length 8
19:00:58.842202 IP ecs-119-8-230-166.compute.hwclouds-dns.com.26378 > 192.168.3.247.65132: UDP, length 124
19:00:58.843218 IP 192.168.3.247.61392 > 49.51.180.215.17000: UDP, length 5
19:00:58.863323 IP 192.168.3.247.65132 > ecs-119-8-230-166.compute.hwclouds-dns.com.26378: UDP, length 89
19:00:58.896684 IP 192.168.3.247.65132 > ecs-119-8-230-166.compute.hwclouds-dns.com.26378: UDP, length 85
19:00:58.897563 IP ecs-119-8-230-166.compute.hwclouds-dns.com.26378 > 192.168.3.247.65132: UDP, length 89
19:00:58.915166 IP 49.51.180.215.17000 > 192.168.3.247.61392: UDP, length 8
19:00:58.930239 IP 192.168.3.247.65132 > ecs-119-8-230-166.compute.hwclouds-dns.com.26378: UDP, length 89
19:00:58.942261 IP 1d.e8.39a9.ip4.static.sl-reverse.com.20002 > 192.168.3.247.60443: UDP, length 42
19:00:58.953262 IP ecs-119-8-230-166.compute.hwclouds-dns.com.26378 > 192.168.3.247.65132: UDP, length 131
19:00:58.965577 IP 192.168.3.247.65132 > ecs-119-8-230-166.compute.hwclouds-dns.com.26378: UDP, length 121
19:00:58.995358 IP 192.168.3.247.65132 > ecs-119-8-230-166.compute.hwclouds-dns.com.26378: UDP, length 85
19:00:59.008784 IP ecs-119-8-230-166.compute.hwclouds-dns.com.26378 > 192.168.3.247.65132: UDP, length 116
19:00:59.028867 IP 192.168.3.247.65132 > ecs-119-8-230-166.compute.hwclouds-dns.com.26378: UDP, length 89
19:00:59.064676 IP ecs-119-8-230-166.compute.hwclouds-dns.com.26378 > 192.168.3.247.65132: UDP, length 124
19:00:59.068885 IP 192.168.3.247.65132 > ecs-119-8-230-166.compute.hwclouds-dns.com.26378: UDP, length 85
19:00:59.095897 IP 192.168.3.247.65132 > ecs-119-8-230-166.compute.hwclouds-dns.com.26378: UDP, length 89
19:00:59.119900 IP ecs-119-8-230-166.compute.hwclouds-dns.com.26378 > 192.168.3.247.65132: UDP, length 82
19:00:59.128686 IP 192.168.3.247.65132 > ecs-119-8-230-166.compute.hwclouds-dns.com.26378: UDP, length 92
19:00:59.162012 IP 192.168.3.247.65132 > ecs-119-8-230-166.compute.hwclouds-dns.com.26378: UDP, length 85
19:00:59.175634 IP ecs-119-8-230-166.compute.hwclouds-dns.com.26378 > 192.168.3.247.65132: UDP, length 123
19:00:59.195438 IP 192.168.3.247.65132 > ecs-119-8-230-166.compute.hwclouds-dns.com.26378: UDP, length 89
19:00:59.228812 IP 192.168.3.247.65132 > ecs-119-8-230-166.compute.hwclouds-dns.com.26378: UDP, length 85
19:00:59.231300 IP ecs-119-8-230-166.compute.hwclouds-dns.com.26378 > 192.168.3.247.65132: UDP, length 83
19:00:59.263703 IP 192.168.3.247.65132 > ecs-119-8-230-166.compute.hwclouds-dns.com.26378: UDP, length 89
19:00:59.287484 IP ecs-119-8-230-166.compute.hwclouds-dns.com.26378 > 192.168.3.247.65132: UDP, length 160
19:00:59.291677 IP 192.168.3.247.60443 > 1d.e8.39a9.ip4.static.sl-reverse.com.20002: UDP, length 51
19:00:59.291678 IP 192.168.3.247.60443 > 1d.e8.39a9.ip4.static.sl-reverse.com.20002: UDP, length 53
19:00:59.291678 IP 192.168.3.247.54718 > 27.e8.39a9.ip4.static.sl-reverse.com.20002: UDP, length 52
19:00:59.296376 IP 192.168.3.247.65132 > ecs-119-8-230-166.compute.hwclouds-dns.com.26378: UDP, length 128
19:00:59.343383 IP ecs-119-8-230-166.compute.hwclouds-dns.com.26378 > 192.168.3.247.65132: UDP, length 92
19:00:59.367795 IP 192.168.3.247.65132 > ecs-119-8-230-166.compute.hwclouds-dns.com.26378: UDP, length 128
19:00:59.367796 IP 192.168.3.247.65132 > ecs-119-8-230-166.compute.hwclouds-dns.com.26378: UDP, length 103
19:00:59.402337 IP 192.168.3.247.65132 > ecs-119-8-230-166.compute.hwclouds-dns.com.26378: UDP, length 127
19:00:59.402711 IP ecs-119-8-230-166.compute.hwclouds-dns.com.26378 > 192.168.3.247.65132: UDP, length 124
19:00:59.431988 IP 192.168.3.247.65132 > ecs-119-8-230-166.compute.hwclouds-dns.com.26378: UDP, length 94
19:00:59.446971 IP 27.e8.39a9.ip4.static.sl-reverse.com.20002 > 192.168.3.247.54718: UDP, length 43
19:00:59.449003 IP 1d.e8.39a9.ip4.static.sl-reverse.com.20002 > 192.168.3.247.60443: UDP, length 44
19:00:59.453799 IP ecs-119-8-230-166.compute.hwclouds-dns.com.26378 > 192.168.3.247.65132: UDP, length 80
19:00:59.491923 IP 192.168.3.247.65132 > ecs-119-8-230-166.compute.hwclouds-dns.com.26378: UDP, length 94
19:00:59.495330 IP 192.168.3.247.65132 > ecs-119-8-230-166.compute.hwclouds-dns.com.26378: UDP, length 87
19:00:59.510052 IP ecs-119-8-230-166.compute.hwclouds-dns.com.26378 > 192.168.3.247.65132: UDP, length 207
19:00:59.529927 IP 192.168.3.247.65132 > ecs-119-8-230-166.compute.hwclouds-dns.com.26378: UDP, length 91
19:00:59.565101 IP ecs-119-8-230-166.compute.hwclouds-dns.com.26378 > 192.168.3.247.65132: UDP, length 92
19:00:59.566534 IP 192.168.3.247.65132 > ecs-119-8-230-166.compute.hwclouds-dns.com.26378: UDP, length 87
19:00:59.595724 IP 192.168.3.247.65132 > ecs-119-8-230-166.compute.hwclouds-dns.com.26378: UDP, length 91
19:00:59.621036 IP ecs-119-8-230-166.compute.hwclouds-dns.com.26378 > 192.168.3.247.65132: UDP, length 226
19:00:59.629906 IP 192.168.3.247.65132 > ecs-119-8-230-166.compute.hwclouds-dns.com.26378: UDP, length 87
19:00:59.663871 IP 192.168.3.247.65132 > ecs-119-8-230-166.compute.hwclouds-dns.com.26378: UDP, length 91
19:00:59.676437 IP ecs-119-8-230-166.compute.hwclouds-dns.com.26378 > 192.168.3.247.65132: UDP, length 124
19:00:59.696902 IP 192.168.3.247.65132 > ecs-119-8-230-166.compute.hwclouds-dns.com.26378: UDP, length 106
19:00:59.730227 IP 192.168.3.247.65132 > ecs-119-8-230-166.compute.hwclouds-dns.com.26378: UDP, length 87
19:00:59.732026 IP ecs-119-8-230-166.compute.hwclouds-dns.com.26378 > 192.168.3.247.65132: UDP, length 188
19:00:59.762573 IP 192.168.3.247.65132 > ecs-119-8-230-166.compute.hwclouds-dns.com.26378: UDP, length 91
19:00:59.787511 IP ecs-119-8-230-166.compute.hwclouds-dns.com.26378 > 192.168.3.247.65132: UDP, length 180
19:00:59.788328 IP 192.168.3.247.60443 > 1d.e8.39a9.ip4.static.sl-reverse.com.20002: UDP, length 61
19:00:59.795794 IP 192.168.3.247.65132 > ecs-119-8-230-166.compute.hwclouds-dns.com.26378: UDP, length 94
19:00:59.830237 IP 192.168.3.247.65132 > ecs-119-8-230-166.compute.hwclouds-dns.com.26378: UDP, length 87
19:00:59.843588 IP ecs-119-8-230-166.compute.hwclouds-dns.com.26378 > 192.168.3.247.65132: UDP, length 165
19:00:59.862855 IP 192.168.3.247.65132 > ecs-119-8-230-166.compute.hwclouds-dns.com.26378: UDP, length 91
19:00:59.895433 IP 192.168.3.247.65132 > ecs-119-8-230-166.compute.hwclouds-dns.com.26378: UDP, length 87
19:00:59.898680 IP ecs-119-8-230-166.compute.hwclouds-dns.com.26378 > 192.168.3.247.65132: UDP, length 99
19:00:59.930636 IP 192.168.3.247.65132 > ecs-119-8-230-166.compute.hwclouds-dns.com.26378: UDP, length 91
19:00:59.945327 IP 1d.e8.39a9.ip4.static.sl-reverse.com.20002 > 192.168.3.247.60443: UDP, length 42
19:00:59.955120 IP ecs-119-8-230-166.compute.hwclouds-dns.com.26378 > 192.168.3.247.65132: UDP, length 151
19:00:59.969239 IP 192.168.3.247.65132 > ecs-119-8-230-166.compute.hwclouds-dns.com.26378: UDP, length 87
19:00:59.995734 IP 192.168.3.247.65132 > ecs-119-8-230-166.compute.hwclouds-dns.com.26378: UDP, length 120
19:01:00.011171 IP ecs-119-8-230-166.compute.hwclouds-dns.com.26378 > 192.168.3.247.65132: UDP, length 123
19:01:00.029307 IP 192.168.3.247.65132 > ecs-119-8-230-166.compute.hwclouds-dns.com.26378: UDP, length 94
19:01:00.062373 IP 192.168.3.247.65132 > ecs-119-8-230-166.compute.hwclouds-dns.com.26378: UDP, length 134
19:01:00.066301 IP ecs-119-8-230-166.compute.hwclouds-dns.com.26378 > 192.168.3.247.65132: UDP, length 144
19:01:00.095422 IP 192.168.3.247.65132 > ecs-119-8-230-166.compute.hwclouds-dns.com.26378: UDP, length 114
19:01:00.121230 IP ecs-119-8-230-166.compute.hwclouds-dns.com.26378 > 192.168.3.247.65132: UDP, length 87
19:01:00.129093 IP 192.168.3.247.65132 > ecs-119-8-230-166.compute.hwclouds-dns.com.26378: UDP, length 117
19:01:00.161780 IP 1d.e8.39a9.ip4.static.sl-reverse.com.20002 > 192.168.3.247.60443: UDP, length 155
19:01:00.162141 IP 192.168.3.247.65132 > ecs-119-8-230-166.compute.hwclouds-dns.com.26378: UDP, length 110
19:01:00.177000 IP ecs-119-8-230-166.compute.hwclouds-dns.com.26378 > 192.168.3.247.65132: UDP, length 143
19:01:00.195591 IP 192.168.3.247.65132 > ecs-119-8-230-166.compute.hwclouds-dns.com.26378: UDP, length 114
19:01:00.228756 IP 192.168.3.247.65132 > ecs-119-8-230-166.compute.hwclouds-dns.com.26378: UDP, length 110
19:01:00.232512 IP ecs-119-8-230-166.compute.hwclouds-dns.com.26378 > 192.168.3.247.65132: UDP, length 131
19:01:00.269221 IP 192.168.3.247.65132 > ecs-119-8-230-166.compute.hwclouds-dns.com.26378: UDP, length 107
19:01:00.288407 IP ecs-119-8-230-166.compute.hwclouds-dns.com.26378 > 192.168.3.247.65132: UDP, length 175
19:01:00.296412 IP 192.168.3.247.65132 > ecs-119-8-230-166.compute.hwclouds-dns.com.26378: UDP, length 117
19:01:00.303265 IP 192.168.3.247.58011 > 49.51.67.140.17500: Flags [P.], seq 1825694635:1825694692, ack 1023566806, win 16384, length 57
19:01:00.328783 IP 192.168.3.247.65132 > ecs-119-8-230-166.compute.hwclouds-dns.com.26378: UDP, length 113
19:01:00.343821 IP ecs-119-8-230-166.compute.hwclouds-dns.com.26378 > 192.168.3.247.65132: UDP, length 122
19:01:00.362527 IP 192.168.3.247.65132 > ecs-119-8-230-166.compute.hwclouds-dns.com.26378: UDP, length 131
19:01:00.399567 IP ecs-119-8-230-166.compute.hwclouds-dns.com.26378 > 192.168.3.247.65132: UDP, length 186
19:01:00.406589 IP 192.168.3.247.65132 > ecs-119-8-230-166.compute.hwclouds-dns.com.26378: UDP, length 110
19:01:00.419480 IP 27.e8.39a9.ip4.static.sl-reverse.com.20002 > 192.168.3.247.54718: UDP, length 154
19:01:00.452112 IP 192.168.3.247.65132 > ecs-119-8-230-166.compute.hwclouds-dns.com.26378: UDP, length 107
19:01:00.456812 IP ecs-119-8-230-166.compute.hwclouds-dns.com.26378 > 192.168.3.247.65132: UDP, length 97
19:01:00.462366 IP 192.168.3.247.65132 > ecs-119-8-230-166.compute.hwclouds-dns.com.26378: UDP, length 114
19:01:00.495584 IP 192.168.3.247.65132 > ecs-119-8-230-166.compute.hwclouds-dns.com.26378: UDP, length 117
19:01:00.510999 IP ecs-119-8-230-166.compute.hwclouds-dns.com.26378 > 192.168.3.247.65132: UDP, length 190
19:01:00.528851 IP 192.168.3.247.65132 > ecs-119-8-230-166.compute.hwclouds-dns.com.26378: UDP, length 117
19:01:00.563930 IP 192.168.3.247.65132 > ecs-119-8-230-166.compute.hwclouds-dns.com.26378: UDP, length 110
19:01:00.566128 IP ecs-119-8-230-166.compute.hwclouds-dns.com.26378 > 192.168.3.247.65132: UDP, length 97
19:01:00.571314 IP 49.51.67.140.17500 > 192.168.3.247.58011: Flags [P.], seq 1:58, ack 57, win 12058, length 57
19:01:00.585375 IP 192.168.3.247.58011 > 49.51.67.140.17500: Flags [.], ack 58, win 16383, length 0
19:01:00.615039 IP 192.168.3.247.65132 > ecs-119-8-230-166.compute.hwclouds-dns.com.26378: UDP, length 107
19:01:00.622334 IP ecs-119-8-230-166.compute.hwclouds-dns.com.26378 > 192.168.3.247.65132: UDP, length 213
19:01:00.628755 IP 192.168.3.247.65132 > ecs-119-8-230-166.compute.hwclouds-dns.com.26378: UDP, length 84
19:01:00.662405 IP 192.168.3.247.65132 > ecs-119-8-230-166.compute.hwclouds-dns.com.26378: UDP, length 114
19:01:00.677537 IP ecs-119-8-230-166.compute.hwclouds-dns.com.26378 > 192.168.3.247.65132: UDP, length 112
19:01:00.695606 IP 192.168.3.247.65132 > ecs-119-8-230-166.compute.hwclouds-dns.com.26378: UDP, length 106
19:01:00.728732 IP 192.168.3.247.65132 > ecs-119-8-230-166.compute.hwclouds-dns.com.26378: UDP, length 87
19:01:00.733226 IP ecs-119-8-230-166.compute.hwclouds-dns.com.26378 > 192.168.3.247.65132: UDP, length 175
19:01:00.762445 IP 192.168.3.247.65132 > ecs-119-8-230-166.compute.hwclouds-dns.com.26378: UDP, length 114
19:01:00.785350 IP 192.168.3.247.60443 > 1d.e8.39a9.ip4.static.sl-reverse.com.20002: UDP, length 61
19:01:00.788832 IP ecs-119-8-230-166.compute.hwclouds-dns.com.26378 > 192.168.3.247.65132: UDP, length 133
19:01:00.795721 IP 192.168.3.247.65132 > ecs-119-8-230-166.compute.hwclouds-dns.com.26378: UDP, length 94
19:01:00.828859 IP 192.168.3.247.65132 > ecs-119-8-230-166.compute.hwclouds-dns.com.26378: UDP, length 87
19:01:00.844553 IP ecs-119-8-230-166.compute.hwclouds-dns.com.26378 > 192.168.3.247.65132: UDP, length 174
19:01:00.868758 IP 192.168.3.247.65132 > ecs-119-8-230-166.compute.hwclouds-dns.com.26378: UDP, length 107
19:01:00.895687 IP 192.168.3.247.65132 > ecs-119-8-230-166.compute.hwclouds-dns.com.26378: UDP, length 114
19:01:00.899868 IP ecs-119-8-230-166.compute.hwclouds-dns.com.26378 > 192.168.3.247.65132: UDP, length 100
19:01:00.928723 IP 192.168.3.247.65132 > ecs-119-8-230-166.compute.hwclouds-dns.com.26378: UDP, length 117
19:01:00.942713 IP 1d.e8.39a9.ip4.static.sl-reverse.com.20002 > 192.168.3.247.60443: UDP, length 42
19:01:00.955717 IP ecs-119-8-230-166.compute.hwclouds-dns.com.26378 > 192.168.3.247.65132: UDP, length 181
19:01:00.962447 IP 192.168.3.247.65132 > ecs-119-8-230-166.compute.hwclouds-dns.com.26378: UDP, length 110
19:01:01.003636 IP 192.168.3.247.65132 > ecs-119-8-230-166.compute.hwclouds-dns.com.26378: UDP, length 143
19:01:01.011071 IP ecs-119-8-230-166.compute.hwclouds-dns.com.26378 > 192.168.3.247.65132: UDP, length 97
19:01:01.029011 IP 192.168.3.247.65132 > ecs-119-8-230-166.compute.hwclouds-dns.com.26378: UDP, length 117
19:01:01.062197 IP 192.168.3.247.65132 > ecs-119-8-230-166.compute.hwclouds-dns.com.26378: UDP, length 110
19:01:01.066940 IP ecs-119-8-230-166.compute.hwclouds-dns.com.26378 > 192.168.3.247.65132: UDP, length 187
19:01:01.095772 IP 192.168.3.247.65132 > ecs-119-8-230-166.compute.hwclouds-dns.com.26378: UDP, length 114
19:01:01.122428 IP ecs-119-8-230-166.compute.hwclouds-dns.com.26378 > 192.168.3.247.65132: UDP, length 187
19:01:01.129162 IP 192.168.3.247.65132 > ecs-119-8-230-166.compute.hwclouds-dns.com.26378: UDP, length 117
19:01:01.170065 IP 192.168.3.247.65132 > ecs-119-8-230-166.compute.hwclouds-dns.com.26378: UDP, length 110
19:01:01.178057 IP ecs-119-8-230-166.compute.hwclouds-dns.com.26378 > 192.168.3.247.65132: UDP, length 173
19:01:01.180238 IP 27.e8.39a9.ip4.static.sl-reverse.com.20002 > 192.168.3.247.54718: UDP, length 154
19:01:01.195626 IP 192.168.3.247.65132 > ecs-119-8-230-166.compute.hwclouds-dns.com.26378: UDP, length 114
19:01:01.228857 IP 192.168.3.247.65132 > ecs-119-8-230-166.compute.hwclouds-dns.com.26378: UDP, length 110
19:01:01.235051 IP ecs-119-8-230-166.compute.hwclouds-dns.com.26378 > 192.168.3.247.65132: UDP, length 88
19:01:01.262341 IP 192.168.3.247.65132 > ecs-119-8-230-166.compute.hwclouds-dns.com.26378: UDP, length 114
19:01:01.289486 IP ecs-119-8-230-166.compute.hwclouds-dns.com.26378 > 192.168.3.247.65132: UDP, length 186
19:01:01.290034 IP 192.168.3.247.54718 > 27.e8.39a9.ip4.static.sl-reverse.com.20002: UDP, length 50
19:01:01.295287 IP 192.168.3.247.65132 > ecs-119-8-230-166.compute.hwclouds-dns.com.26378: UDP, length 110
19:01:01.328619 IP 192.168.3.247.65132 > ecs-119-8-230-166.compute.hwclouds-dns.com.26378: UDP, length 114
19:01:01.345482 IP ecs-119-8-230-166.compute.hwclouds-dns.com.26378 > 192.168.3.247.65132: UDP, length 103
19:01:01.364239 IP 192.168.3.247.65132 > ecs-119-8-230-166.compute.hwclouds-dns.com.26378: UDP, length 134
19:01:01.395528 IP 192.168.3.247.65132 > ecs-119-8-230-166.compute.hwclouds-dns.com.26378: UDP, length 110
19:01:01.400658 IP ecs-119-8-230-166.compute.hwclouds-dns.com.26378 > 192.168.3.247.65132: UDP, length 164
19:01:01.428677 IP 192.168.3.247.65132 > ecs-119-8-230-166.compute.hwclouds-dns.com.26378: UDP, length 114
19:01:01.456328 IP ecs-119-8-230-166.compute.hwclouds-dns.com.26378 > 192.168.3.247.65132: UDP, length 91
19:01:01.468679 IP 192.168.3.247.65132 > ecs-119-8-230-166.compute.hwclouds-dns.com.26378: UDP, length 110
19:01:01.470773 IP 1d.e8.39a9.ip4.static.sl-reverse.com.20002 > 192.168.3.247.60443: UDP, length 155
19:01:01.501459 IP 192.168.3.247.65132 > ecs-119-8-230-166.compute.hwclouds-dns.com.26378: UDP, length 114
19:01:01.512045 IP ecs-119-8-230-166.compute.hwclouds-dns.com.26378 > 192.168.3.247.65132: UDP, length 191
19:01:01.537078 IP 192.168.3.247.65132 > ecs-119-8-230-166.compute.hwclouds-dns.com.26378: UDP, length 117
19:01:01.567323 IP ecs-119-8-230-166.compute.hwclouds-dns.com.26378 > 192.168.3.247.65132: UDP, length 97
19:01:01.569651 IP 192.168.3.247.65132 > ecs-119-8-230-166.compute.hwclouds-dns.com.26378: UDP, length 110
19:01:01.595215 IP 192.168.3.247.65132 > ecs-119-8-230-166.compute.hwclouds-dns.com.26378: UDP, length 114
19:01:01.623501 IP ecs-119-8-230-166.compute.hwclouds-dns.com.26378 > 192.168.3.247.65132: UDP, length 197
19:01:01.628745 IP 192.168.3.247.65132 > ecs-119-8-230-166.compute.hwclouds-dns.com.26378: UDP, length 110
19:01:01.662398 IP 192.168.3.247.65132 > ecs-119-8-230-166.compute.hwclouds-dns.com.26378: UDP, length 114
19:01:01.678657 IP ecs-119-8-230-166.compute.hwclouds-dns.com.26378 > 192.168.3.247.65132: UDP, length 103
19:01:01.696609 IP 192.168.3.247.65132 > ecs-119-8-230-166.compute.hwclouds-dns.com.26378: UDP, length 129
19:01:01.729956 IP 192.168.3.247.65132 > ecs-119-8-230-166.compute.hwclouds-dns.com.26378: UDP, length 110
19:01:01.734239 IP ecs-119-8-230-166.compute.hwclouds-dns.com.26378 > 192.168.3.247.65132: UDP, length 189
19:01:01.769215 IP 192.168.3.247.58011 > 49.51.67.140.17500: Flags [.], ack 58, win 16384, length 0
19:01:01.769217 IP 192.168.3.247.65132 > ecs-119-8-230-166.compute.hwclouds-dns.com.26378: UDP, length 107
19:01:01.789199 IP 192.168.3.247.60443 > 1d.e8.39a9.ip4.static.sl-reverse.com.20002: UDP, length 61
19:01:01.789796 IP ecs-119-8-230-166.compute.hwclouds-dns.com.26378 > 192.168.3.247.65132: UDP, length 94
19:01:01.796127 IP 192.168.3.247.65132 > ecs-119-8-230-166.compute.hwclouds-dns.com.26378: UDP, length 117
19:01:01.828688 IP 192.168.3.247.65132 > ecs-119-8-230-166.compute.hwclouds-dns.com.26378: UDP, length 90
19:01:01.845681 IP ecs-119-8-230-166.compute.hwclouds-dns.com.26378 > 192.168.3.247.65132: UDP, length 155
19:01:01.862836 IP 192.168.3.247.65132 > ecs-119-8-230-166.compute.hwclouds-dns.com.26378: UDP, length 114
19:01:01.895262 IP 192.168.3.247.65132 > ecs-119-8-230-166.compute.hwclouds-dns.com.26378: UDP, length 87
19:01:01.901684 IP ecs-119-8-230-166.compute.hwclouds-dns.com.26378 > 192.168.3.247.65132: UDP, length 91
19:01:01.928875 IP 192.168.3.247.65132 > ecs-119-8-230-166.compute.hwclouds-dns.com.26378: UDP, length 91
19:01:01.945740 IP 1d.e8.39a9.ip4.static.sl-reverse.com.20002 > 192.168.3.247.60443: UDP, length 42
19:01:01.957110 IP ecs-119-8-230-166.compute.hwclouds-dns.com.26378 > 192.168.3.247.65132: UDP, length 194
19:01:01.962925 IP 192.168.3.247.65132 > ecs-119-8-230-166.compute.hwclouds-dns.com.26378: UDP, length 87
19:01:01.995633 IP 192.168.3.247.65132 > ecs-119-8-230-166.compute.hwclouds-dns.com.26378: UDP, length 175
19:01:02.012316 IP ecs-119-8-230-166.compute.hwclouds-dns.com.26378 > 192.168.3.247.65132: UDP, length 94
19:01:02.039579 IP 49.51.67.140.17500 > 192.168.3.247.58011: Flags [.], ack 57, win 12058, length 0
19:01:02.068029 IP ecs-119-8-230-166.compute.hwclouds-dns.com.26378 > 192.168.3.247.65132: UDP, length 156
19:01:02.068340 IP 192.168.3.247.65132 > ecs-119-8-230-166.compute.hwclouds-dns.com.26378: UDP, length 94
19:01:02.068342 IP 192.168.3.247.65132 > ecs-119-8-230-166.compute.hwclouds-dns.com.26378: UDP, length 87
19:01:02.095515 IP 192.168.3.247.65132 > ecs-119-8-230-166.compute.hwclouds-dns.com.26378: UDP, length 91
19:01:02.123583 IP ecs-119-8-230-166.compute.hwclouds-dns.com.26378 > 192.168.3.247.65132: UDP, length 135
19:01:02.128675 IP 192.168.3.247.65132 > ecs-119-8-230-166.compute.hwclouds-dns.com.26378: UDP, length 87
19:01:02.162344 IP 192.168.3.247.65132 > ecs-119-8-230-166.compute.hwclouds-dns.com.26378: UDP, length 91
19:01:02.179188 IP ecs-119-8-230-166.compute.hwclouds-dns.com.26378 > 192.168.3.247.65132: UDP, length 66
19:01:02.195387 IP 192.168.3.247.65132 > ecs-119-8-230-166.compute.hwclouds-dns.com.26378: UDP, length 94
19:01:02.228791 IP 192.168.3.247.65132 > ecs-119-8-230-166.compute.hwclouds-dns.com.26378: UDP, length 87
19:01:02.234912 IP ecs-119-8-230-166.compute.hwclouds-dns.com.26378 > 192.168.3.247.65132: UDP, length 180
19:01:02.262565 IP 192.168.3.247.65132 > ecs-119-8-230-166.compute.hwclouds-dns.com.26378: UDP, length 91
19:01:02.290124 IP 192.168.3.247.60443 > 1d.e8.39a9.ip4.static.sl-reverse.com.20002: UDP, length 53
19:01:02.290125 IP 192.168.3.247.54718 > 27.e8.39a9.ip4.static.sl-reverse.com.20002: UDP, length 52
19:01:02.290481 IP ecs-119-8-230-166.compute.hwclouds-dns.com.26378 > 192.168.3.247.65132: UDP, length 72
19:01:02.295271 IP 192.168.3.247.65132 > ecs-119-8-230-166.compute.hwclouds-dns.com.26378: UDP, length 87
19:01:02.330805 IP 192.168.3.247.65132 > ecs-119-8-230-166.compute.hwclouds-dns.com.26378: UDP, length 91
19:01:02.345991 IP ecs-119-8-230-166.compute.hwclouds-dns.com.26378 > 192.168.3.247.65132: UDP, length 145
19:01:02.368926 IP 192.168.3.247.65132 > ecs-119-8-230-166.compute.hwclouds-dns.com.26378: UDP, length 87
19:01:02.396084 IP 192.168.3.247.65132 > ecs-119-8-230-166.compute.hwclouds-dns.com.26378: UDP, length 107
19:01:02.401578 IP ecs-119-8-230-166.compute.hwclouds-dns.com.26378 > 192.168.3.247.65132: UDP, length 72
19:01:02.428887 IP 192.168.3.247.65132 > ecs-119-8-230-166.compute.hwclouds-dns.com.26378: UDP, length 94
19:01:02.445129 IP 27.e8.39a9.ip4.static.sl-reverse.com.20002 > 192.168.3.247.54718: UDP, length 43
19:01:02.446910 IP 1d.e8.39a9.ip4.static.sl-reverse.com.20002 > 192.168.3.247.60443: UDP, length 44
19:01:02.457480 IP ecs-119-8-230-166.compute.hwclouds-dns.com.26378 > 192.168.3.247.65132: UDP, length 256
19:01:02.462272 IP 192.168.3.247.65132 > ecs-119-8-230-166.compute.hwclouds-dns.com.26378: UDP, length 87
19:01:02.499933 IP 192.168.3.247.65132 > ecs-119-8-230-166.compute.hwclouds-dns.com.26378: UDP, length 114
19:01:02.512829 IP ecs-119-8-230-166.compute.hwclouds-dns.com.26378 > 192.168.3.247.65132: UDP, length 71
19:01:02.528742 IP 192.168.3.247.65132 > ecs-119-8-230-166.compute.hwclouds-dns.com.26378: UDP, length 94
19:01:02.562159 IP 192.168.3.247.65132 > ecs-119-8-230-166.compute.hwclouds-dns.com.26378: UDP, length 87
19:01:02.568532 IP ecs-119-8-230-166.compute.hwclouds-dns.com.26378 > 192.168.3.247.65132: UDP, length 136
19:01:02.605128 IP 192.168.3.247.65132 > ecs-119-8-230-166.compute.hwclouds-dns.com.26378: UDP, length 91
19:01:02.624145 IP ecs-119-8-230-166.compute.hwclouds-dns.com.26378 > 192.168.3.247.65132: UDP, length 113
19:01:02.640302 IP 192.168.3.247.65132 > ecs-119-8-230-166.compute.hwclouds-dns.com.26378: UDP, length 87
19:01:02.663950 IP 192.168.3.247.65132 > ecs-119-8-230-166.compute.hwclouds-dns.com.26378: UDP, length 84
19:01:02.679846 IP ecs-119-8-230-166.compute.hwclouds-dns.com.26378 > 192.168.3.247.65132: UDP, length 155
19:01:02.695647 IP 192.168.3.247.65132 > ecs-119-8-230-166.compute.hwclouds-dns.com.26378: UDP, length 103
19:01:02.728685 IP 192.168.3.247.65132 > ecs-119-8-230-166.compute.hwclouds-dns.com.26378: UDP, length 110
19:01:02.735470 IP ecs-119-8-230-166.compute.hwclouds-dns.com.26378 > 192.168.3.247.65132: UDP, length 136
19:01:02.762394 IP 192.168.3.247.65132 > ecs-119-8-230-166.compute.hwclouds-dns.com.26378: UDP, length 91
19:01:02.784951 IP 192.168.3.247.60443 > 1d.e8.39a9.ip4.static.sl-reverse.com.20002: UDP, length 61
19:01:02.790878 IP ecs-119-8-230-166.compute.hwclouds-dns.com.26378 > 192.168.3.247.65132: UDP, length 141
19:01:02.797877 IP 192.168.3.247.65132 > ecs-119-8-230-166.compute.hwclouds-dns.com.26378: UDP, length 87
19:01:02.829704 IP 192.168.3.247.65132 > ecs-119-8-230-166.compute.hwclouds-dns.com.26378: UDP, length 91
19:01:02.846568 IP ecs-119-8-230-166.compute.hwclouds-dns.com.26378 > 192.168.3.247.65132: UDP, length 74
19:01:02.862755 IP 192.168.3.247.65132 > ecs-119-8-230-166.compute.hwclouds-dns.com.26378: UDP, length 94
19:01:02.895348 IP 192.168.3.247.65132 > ecs-119-8-230-166.compute.hwclouds-dns.com.26378: UDP, length 87
19:01:02.902227 IP ecs-119-8-230-166.compute.hwclouds-dns.com.26378 > 192.168.3.247.65132: UDP, length 141
19:01:02.929877 IP 192.168.3.247.65132 > ecs-119-8-230-166.compute.hwclouds-dns.com.26378: UDP, length 91
19:01:02.941678 IP 1d.e8.39a9.ip4.static.sl-reverse.com.20002 > 192.168.3.247.60443: UDP, length 42
19:01:02.957806 IP ecs-119-8-230-166.compute.hwclouds-dns.com.26378 > 192.168.3.247.65132: UDP, length 93
19:01:02.968810 IP 192.168.3.247.65132 > ecs-119-8-230-166.compute.hwclouds-dns.com.26378: UDP, length 87
19:01:02.995677 IP 192.168.3.247.65132 > ecs-119-8-230-166.compute.hwclouds-dns.com.26378: UDP, length 120
19:01:03.013330 IP ecs-119-8-230-166.compute.hwclouds-dns.com.26378 > 192.168.3.247.65132: UDP, length 169
19:01:03.030738 IP 192.168.3.247.65132 > ecs-119-8-230-166.compute.hwclouds-dns.com.26378: UDP, length 87
19:01:03.062448 IP 192.168.3.247.65132 > ecs-119-8-230-166.compute.hwclouds-dns.com.26378: UDP, length 91
19:01:03.069149 IP ecs-119-8-230-166.compute.hwclouds-dns.com.26378 > 192.168.3.247.65132: UDP, length 72
19:01:03.095336 IP 192.168.3.247.65132 > ecs-119-8-230-166.compute.hwclouds-dns.com.26378: UDP, length 94
19:01:03.125372 IP ecs-119-8-230-166.compute.hwclouds-dns.com.26378 > 192.168.3.247.65132: UDP, length 133
19:01:03.128699 IP 192.168.3.247.65132 > ecs-119-8-230-166.compute.hwclouds-dns.com.26378: UDP, length 87
19:01:03.176496 IP 192.168.3.247.65132 > ecs-119-8-230-166.compute.hwclouds-dns.com.26378: UDP, length 91
19:01:03.181086 IP ecs-119-8-230-166.compute.hwclouds-dns.com.26378 > 192.168.3.247.65132: UDP, length 82
19:01:03.195425 IP 192.168.3.247.65132 > ecs-119-8-230-166.compute.hwclouds-dns.com.26378: UDP, length 94
19:01:03.228742 IP 192.168.3.247.65132 > ecs-119-8-230-166.compute.hwclouds-dns.com.26378: UDP, length 87
19:01:03.236547 IP ecs-119-8-230-166.compute.hwclouds-dns.com.26378 > 192.168.3.247.65132: UDP, length 146
19:01:03.268158 IP 192.168.3.247.65132 > ecs-119-8-230-166.compute.hwclouds-dns.com.26378: UDP, length 84
19:01:03.283210 IP 192.168.3.247.60443 > 1d.e8.39a9.ip4.static.sl-reverse.com.20002: UDP, length 51
19:01:03.283211 IP 192.168.3.247.60443 > 1d.e8.39a9.ip4.static.sl-reverse.com.20002: UDP, length 118
19:01:03.283211 IP 192.168.3.247.54718 > 27.e8.39a9.ip4.static.sl-reverse.com.20002: UDP, length 138
19:01:03.292303 IP ecs-119-8-230-166.compute.hwclouds-dns.com.26378 > 192.168.3.247.65132: UDP, length 102
19:01:03.296311 IP 192.168.3.247.65132 > ecs-119-8-230-166.compute.hwclouds-dns.com.26378: UDP, length 91
19:01:03.328832 IP 192.168.3.247.65132 > ecs-119-8-230-166.compute.hwclouds-dns.com.26378: UDP, length 94
19:01:03.347214 IP ecs-119-8-230-166.compute.hwclouds-dns.com.26378 > 192.168.3.247.65132: UDP, length 146
19:01:03.362487 IP 192.168.3.247.65132 > ecs-119-8-230-166.compute.hwclouds-dns.com.26378: UDP, length 109
19:01:03.397232 IP 192.168.3.247.65132 > ecs-119-8-230-166.compute.hwclouds-dns.com.26378: UDP, length 87
19:01:03.403550 IP ecs-119-8-230-166.compute.hwclouds-dns.com.26378 > 192.168.3.247.65132: UDP, length 72
19:01:03.430170 IP 192.168.3.247.65132 > ecs-119-8-230-166.compute.hwclouds-dns.com.26378: UDP, length 91
19:01:03.458451 IP ecs-119-8-230-166.compute.hwclouds-dns.com.26378 > 192.168.3.247.65132: UDP, length 133
19:01:03.463511 IP 192.168.3.247.65132 > ecs-119-8-230-166.compute.hwclouds-dns.com.26378: UDP, length 87
19:01:03.498375 IP 192.168.3.247.65132 > ecs-119-8-230-166.compute.hwclouds-dns.com.26378: UDP, length 91
19:01:03.514189 IP ecs-119-8-230-166.compute.hwclouds-dns.com.26378 > 192.168.3.247.65132: UDP, length 71
19:01:03.545573 IP 192.168.3.247.65132 > ecs-119-8-230-166.compute.hwclouds-dns.com.26378: UDP, length 87
19:01:03.569980 IP ecs-119-8-230-166.compute.hwclouds-dns.com.26378 > 192.168.3.247.65132: UDP, length 167
19:01:03.577056 IP 192.168.3.247.65132 > ecs-119-8-230-166.compute.hwclouds-dns.com.26378: UDP, length 84
19:01:03.596623 IP 192.168.3.247.65132 > ecs-119-8-230-166.compute.hwclouds-dns.com.26378: UDP, length 94
19:01:03.625361 IP ecs-119-8-230-166.compute.hwclouds-dns.com.26378 > 192.168.3.247.65132: UDP, length 113
19:01:03.628888 IP 192.168.3.247.65132 > ecs-119-8-230-166.compute.hwclouds-dns.com.26378: UDP, length 90
19:01:03.663789 IP 192.168.3.247.65132 > ecs-119-8-230-166.compute.hwclouds-dns.com.26378: UDP, length 91
19:01:03.681018 IP ecs-119-8-230-166.compute.hwclouds-dns.com.26378 > 192.168.3.247.65132: UDP, length 144
19:01:03.681338 IP 192.168.3.247.60443 > 1d.e8.39a9.ip4.static.sl-reverse.com.20002: UDP, length 71
19:01:03.681340 IP 192.168.3.247.54718 > 27.e8.39a9.ip4.static.sl-reverse.com.20002: UDP, length 70
19:01:03.695533 IP 192.168.3.247.65132 > ecs-119-8-230-166.compute.hwclouds-dns.com.26378: UDP, length 106
19:01:03.732487 IP 192.168.3.247.65132 > ecs-119-8-230-166.compute.hwclouds-dns.com.26378: UDP, length 87
19:01:03.736463 IP ecs-119-8-230-166.compute.hwclouds-dns.com.26378 > 192.168.3.247.65132: UDP, length 74
19:01:03.764129 IP 192.168.3.247.65132 > ecs-119-8-230-166.compute.hwclouds-dns.com.26378: UDP, length 91
19:01:03.789102 IP 192.168.3.247.60443 > 1d.e8.39a9.ip4.static.sl-reverse.com.20002: UDP, length 61
19:01:03.792260 IP ecs-119-8-230-166.compute.hwclouds-dns.com.26378 > 192.168.3.247.65132: UDP, length 270
19:01:03.795639 IP 192.168.3.247.65132 > ecs-119-8-230-166.compute.hwclouds-dns.com.26378: UDP, length 87
19:01:03.832800 IP 192.168.3.247.65132 > ecs-119-8-230-166.compute.hwclouds-dns.com.26378: UDP, length 91
19:01:03.847929 IP ecs-119-8-230-166.compute.hwclouds-dns.com.26378 > 192.168.3.247.65132: UDP, length 71
19:01:03.868744 IP 192.168.3.247.65132 > ecs-119-8-230-166.compute.hwclouds-dns.com.26378: UDP, length 87
19:01:03.895524 IP 192.168.3.247.65132 > ecs-119-8-230-166.compute.hwclouds-dns.com.26378: UDP, length 91
19:01:03.903334 IP ecs-119-8-230-166.compute.hwclouds-dns.com.26378 > 192.168.3.247.65132: UDP, length 136
19:01:03.928866 IP 192.168.3.247.65132 > ecs-119-8-230-166.compute.hwclouds-dns.com.26378: UDP, length 94
19:01:03.945761 IP 1d.e8.39a9.ip4.static.sl-reverse.com.20002 > 192.168.3.247.60443: UDP, length 42
19:01:03.951030 IP 192.168.3.247.61392 > 49.51.180.215.17000: UDP, length 5
19:01:03.959209 IP ecs-119-8-230-166.compute.hwclouds-dns.com.26378 > 192.168.3.247.65132: UDP, length 78
19:01:03.962234 IP 192.168.3.247.65132 > ecs-119-8-230-166.compute.hwclouds-dns.com.26378: UDP, length 87
19:01:03.995540 IP 192.168.3.247.65132 > ecs-119-8-230-166.compute.hwclouds-dns.com.26378: UDP, length 143
19:01:04.014654 IP ecs-119-8-230-166.compute.hwclouds-dns.com.26378 > 192.168.3.247.65132: UDP, length 133
19:01:04.022731 IP 49.51.180.215.17000 > 192.168.3.247.61392: UDP, length 8
19:01:04.026720 IP 192.168.3.247.61392 > 49.51.180.215.17000: UDP, length 5
19:01:04.028861 IP 192.168.3.247.65132 > ecs-119-8-230-166.compute.hwclouds-dns.com.26378: UDP, length 94
19:01:04.062763 IP 192.168.3.247.65132 > ecs-119-8-230-166.compute.hwclouds-dns.com.26378: UDP, length 87
19:01:04.070186 IP ecs-119-8-230-166.compute.hwclouds-dns.com.26378 > 192.168.3.247.65132: UDP, length 103
19:01:04.095593 IP 192.168.3.247.65132 > ecs-119-8-230-166.compute.hwclouds-dns.com.26378: UDP, length 91
19:01:04.098634 IP 49.51.180.215.17000 > 192.168.3.247.61392: UDP, length 8
19:01:04.125983 IP ecs-119-8-230-166.compute.hwclouds-dns.com.26378 > 192.168.3.247.65132: UDP, length 133
19:01:04.129783 IP 192.168.3.247.65132 > ecs-119-8-230-166.compute.hwclouds-dns.com.26378: UDP, length 87
