22:14:05.525463 IP OpenWrt.lan.22 > DESKTOP-3Q7IHRH.lan.56555: Flags [P.], seq 3275908885:3275909073, ack 1633831050, win 1002, length 188
22:14:05.542664 IP 170.106.162.74.10130 > 192.168.3.247.64858: UDP, length 44
22:14:05.544454 IP 192.168.3.247.64858 > 170.106.162.74.10130: UDP, length 18
22:14:05.577932 IP 192.168.3.247.64858 > 170.106.162.74.10130: UDP, length 18
22:14:05.587156 IP DESKTOP-3Q7IHRH.lan.56555 > OpenWrt.lan.22: Flags [.], ack 188, win 8349, length 0
22:14:05.598116 IP 170.106.162.74.10130 > 192.168.3.247.64858: UDP, length 12
22:14:05.611389 IP 192.168.3.247.64858 > 170.106.162.74.10130: UDP, length 21
22:14:05.644530 IP 192.168.3.247.64858 > 170.106.162.74.10130: UDP, length 18
22:14:05.653869 IP 170.106.162.74.10130 > 192.168.3.247.64858: UDP, length 53
22:14:05.681003 IP 192.168.3.247.64858 > 170.106.162.74.10130: UDP, length 18
22:14:05.691469 IP server-108-156-107-124.ord56.r.cloudfront.net.443 > DESKTOP-3Q7IHRH.lan.56959: Flags [.], seq 2858687005:2858688445, ack 750155214, win 2471, length 1440
22:14:05.691480 IP server-108-156-107-124.ord56.r.cloudfront.net.443 > DESKTOP-3Q7IHRH.lan.56959: Flags [P.], seq 1440:1730, ack 1, win 2471, length 290
22:14:05.691486 IP server-108-156-107-124.ord56.r.cloudfront.net.443 > DESKTOP-3Q7IHRH.lan.56959: Flags [P.], seq 1730:1761, ack 1, win 2471, length 31
22:14:05.709340 IP 170.106.162.74.10130 > 192.168.3.247.64858: UDP, length 12
22:14:05.710502 IP 192.168.3.247.64858 > 170.106.162.74.10130: UDP, length 18
22:14:05.744476 IP 192.168.3.247.64858 > 170.106.162.74.10130: UDP, length 18
22:14:05.765174 IP 170.106.162.74.10130 > 192.168.3.247.64858: UDP, length 50
22:14:05.778993 IP 192.168.3.247.64858 > 170.106.162.74.10130: UDP, length 21
22:14:05.810582 IP 192.168.3.247.64858 > 170.106.162.74.10130: UDP, length 18
22:14:05.820803 IP 170.106.162.74.10130 > 192.168.3.247.64858: UDP, length 15
22:14:05.843927 IP 192.168.3.247.64858 > 170.106.162.74.10130: UDP, length 18
22:14:05.852049 IP DESKTOP-3Q7IHRH.lan.56959 > server-108-156-107-124.ord56.r.cloudfront.net.443: Flags [.], ack 1730, win 8313, length 0
22:14:05.869689 IP DESKTOP-3Q7IHRH.lan.56959 > server-108-156-107-124.ord56.r.cloudfront.net.443: Flags [P.], seq 1:237, ack 1761, win 8313, length 236
22:14:05.876358 IP 170.106.162.74.10130 > 192.168.3.247.64858: UDP, length 50
22:14:05.877925 IP 192.168.3.247.64858 > 170.106.162.74.10130: UDP, length 18
22:14:05.887562 IP server-108-156-107-124.ord56.r.cloudfront.net.443 > DESKTOP-3Q7IHRH.lan.56959: Flags [.], ack 237, win 2471, length 0
22:14:05.906882 IP 192.168.3.247.54541 > 49.51.231.117.20002: UDP, length 55
22:14:05.912867 IP 192.168.3.247.64858 > 170.106.162.74.10130: UDP, length 18
22:14:05.932189 IP 170.106.162.74.10130 > 192.168.3.247.64858: UDP, length 23
22:14:05.944525 IP 192.168.3.247.64858 > 170.106.162.74.10130: UDP, length 36
22:14:05.977600 IP 192.168.3.247.64858 > 170.106.162.74.10130: UDP, length 18
22:14:05.979416 IP 49.51.231.117.20002 > 192.168.3.247.54541: UDP, length 23
22:14:05.988542 IP 170.106.162.74.10130 > 192.168.3.247.64858: UDP, length 47
22:14:06.011217 IP 192.168.3.247.64858 > 170.106.162.74.10130: UDP, length 18
22:14:06.022780 IP 192.168.3.247.63751 > 49.51.41.170.20000: UDP, length 50
22:14:06.043094 IP 170.106.162.74.10130 > 192.168.3.247.64858: UDP, length 12
22:14:06.044246 IP 192.168.3.247.64858 > 170.106.162.74.10130: UDP, length 18
22:14:06.076443 IP 192.168.3.247.64858 > 170.106.162.74.10130: UDP, length 18
22:14:06.099530 IP 170.106.162.74.10130 > 192.168.3.247.64858: UDP, length 50
22:14:06.112264 IP 192.168.3.247.64858 > 170.106.162.74.10130: UDP, length 21
22:14:06.143584 IP 192.168.3.247.64858 > 170.106.162.74.10130: UDP, length 18
22:14:06.154479 IP 170.106.162.74.10130 > 192.168.3.247.64858: UDP, length 26
22:14:06.177604 IP 192.168.3.247.64858 > 170.106.162.74.10130: UDP, length 37
22:14:06.210591 IP 192.168.3.247.64858 > 170.106.162.74.10130: UDP, length 18
22:14:06.210629 IP 170.106.162.74.10130 > 192.168.3.247.64858: UDP, length 50
22:14:06.246432 IP 192.168.3.247.64858 > 170.106.162.74.10130: UDP, length 18
22:14:06.265503 IP 170.106.162.74.10130 > 192.168.3.247.64858: UDP, length 12
22:14:06.277235 IP 192.168.3.247.64858 > 170.106.162.74.10130: UDP, length 21
22:14:06.311412 IP 192.168.3.247.64858 > 170.106.162.74.10130: UDP, length 18
22:14:06.321456 IP 170.106.162.74.10130 > 192.168.3.247.64858: UDP, length 47
22:14:06.344015 IP 192.168.3.247.64858 > 170.106.162.74.10130: UDP, length 18
22:14:06.376736 IP 170.106.162.74.10130 > 192.168.3.247.64858: UDP, length 12
22:14:06.382223 IP 192.168.3.247.64858 > 170.106.162.74.10130: UDP, length 27
22:14:06.411224 IP 192.168.3.247.64858 > 170.106.162.74.10130: UDP, length 18
22:14:06.432641 IP 170.106.162.74.10130 > 192.168.3.247.64858: UDP, length 44
22:14:06.442723 IP 192.168.3.247.64858 > 170.106.162.74.10130: UDP, length 21
22:14:06.477149 IP 192.168.3.247.64858 > 170.106.162.74.10130: UDP, length 18
22:14:06.488111 IP 170.106.162.74.10130 > 192.168.3.247.64858: UDP, length 15
22:14:06.510854 IP 192.168.3.247.64858 > 170.106.162.74.10130: UDP, length 18
22:14:06.543958 IP 170.106.162.74.10130 > 192.168.3.247.64858: UDP, length 44
22:14:06.544093 IP 192.168.3.247.64858 > 170.106.162.74.10130: UDP, length 18
22:14:06.577770 IP 192.168.3.247.64858 > 170.106.162.74.10130: UDP, length 18
22:14:06.599339 IP 170.106.162.74.10130 > 192.168.3.247.64858: UDP, length 12
22:14:06.610957 IP 192.168.3.247.64858 > 170.106.162.74.10130: UDP, length 21
22:14:06.644527 IP 192.168.3.247.64858 > 170.106.162.74.10130: UDP, length 18
22:14:06.655489 IP 170.106.162.74.10130 > 192.168.3.247.64858: UDP, length 47
22:14:06.677175 IP 192.168.3.247.64858 > 170.106.162.74.10130: UDP, length 18
22:14:06.710520 IP 192.168.3.247.64858 > 170.106.162.74.10130: UDP, length 18
22:14:06.711240 IP 170.106.162.74.10130 > 192.168.3.247.64858: UDP, length 12
22:14:06.746857 IP 192.168.3.247.64858 > 170.106.162.74.10130: UDP, length 18
22:14:06.767514 IP 170.106.162.74.10130 > 192.168.3.247.64858: UDP, length 50
22:14:06.777689 IP 192.168.3.247.64858 > 170.106.162.74.10130: UDP, length 18
22:14:06.812806 IP 192.168.3.247.64858 > 170.106.162.74.10130: UDP, length 18
22:14:06.822148 IP 170.106.162.74.10130 > 192.168.3.247.64858: UDP, length 15
22:14:06.844937 IP 192.168.3.247.64858 > 170.106.162.74.10130: UDP, length 21
22:14:06.878394 IP 192.168.3.247.64858 > 170.106.162.74.10130: UDP, length 18
22:14:06.878424 IP 170.106.162.74.10130 > 192.168.3.247.64858: UDP, length 56
22:14:06.914529 IP 192.168.3.247.64858 > 170.106.162.74.10130: UDP, length 18
22:14:06.919478 IP 192.168.3.247.54541 > 49.51.231.117.20002: UDP, length 55
22:14:06.933529 IP 170.106.162.74.10130 > 192.168.3.247.64858: UDP, length 23
22:14:06.944409 IP 192.168.3.247.64858 > 170.106.162.74.10130: UDP, length 36
22:14:06.978159 IP 192.168.3.247.64858 > 170.106.162.74.10130: UDP, length 18
22:14:06.989724 IP 170.106.162.74.10130 > 192.168.3.247.64858: UDP, length 53
22:14:06.991963 IP 49.51.231.117.20002 > 192.168.3.247.54541: UDP, length 23
22:14:07.012494 IP 192.168.3.247.64858 > 170.106.162.74.10130: UDP, length 18
22:14:07.032094 IP 192.168.3.247.54541 > 49.51.231.117.20002: UDP, length 50
22:14:07.032111 IP 192.168.3.247.63751 > 49.51.41.170.20000: UDP, length 52
22:14:07.045155 IP 170.106.162.74.10130 > 192.168.3.247.64858: UDP, length 12
22:14:07.045257 IP 192.168.3.247.64858 > 170.106.162.74.10130: UDP, length 18
22:14:07.048315 IP 192.168.3.247.49950 > 49.51.67.140.17500: Flags [P.], seq 1251578517:1251578574, ack 2093219159, win 16384, length 57
22:14:07.079252 IP 192.168.3.247.64858 > 170.106.162.74.10130: UDP, length 18
22:14:07.101069 IP 170.106.162.74.10130 > 192.168.3.247.64858: UDP, length 50
22:14:07.103108 IP 49.51.41.170.20000 > 192.168.3.247.63751: UDP, length 25
22:14:07.119326 IP 192.168.3.247.64858 > 170.106.162.74.10130: UDP, length 21
22:14:07.143160 IP 192.168.3.247.64858 > 170.106.162.74.10130: UDP, length 18
22:14:07.155903 IP 170.106.162.74.10130 > 192.168.3.247.64858: UDP, length 26
22:14:07.177129 IP 192.168.3.247.64858 > 170.106.162.74.10130: UDP, length 37
22:14:07.210743 IP 192.168.3.247.64858 > 170.106.162.74.10130: UDP, length 18
22:14:07.211652 IP 170.106.162.74.10130 > 192.168.3.247.64858: UDP, length 44
22:14:07.244403 IP 192.168.3.247.64858 > 170.106.162.74.10130: UDP, length 18
22:14:07.267329 IP 170.106.162.74.10130 > 192.168.3.247.64858: UDP, length 12
22:14:07.277076 IP 192.168.3.247.64858 > 170.106.162.74.10130: UDP, length 21
22:14:07.310486 IP 192.168.3.247.64858 > 170.106.162.74.10130: UDP, length 18
22:14:07.313835 IP 49.51.67.140.17500 > 192.168.3.247.49950: Flags [P.], seq 1:58, ack 57, win 28293, length 57
22:14:07.317799 IP 192.168.3.247.49950 > 49.51.67.140.17500: Flags [.], ack 58, win 16383, length 0
22:14:07.323036 IP 170.106.162.74.10130 > 192.168.3.247.64858: UDP, length 47
22:14:07.343832 IP 192.168.3.247.64858 > 170.106.162.74.10130: UDP, length 18
22:14:07.377473 IP 192.168.3.247.64858 > 170.106.162.74.10130: UDP, length 18
22:14:07.378509 IP 170.106.162.74.10130 > 192.168.3.247.64858: UDP, length 12
22:14:07.410433 IP 192.168.3.247.64858 > 170.106.162.74.10130: UDP, length 18
22:14:07.434701 IP 170.106.162.74.10130 > 192.168.3.247.64858: UDP, length 44
22:14:07.444137 IP 192.168.3.247.64858 > 170.106.162.74.10130: UDP, length 21
22:14:07.477617 IP 192.168.3.247.64858 > 170.106.162.74.10130: UDP, length 18
22:14:07.490174 IP 170.106.162.74.10130 > 192.168.3.247.64858: UDP, length 15
22:14:07.510940 IP 192.168.3.247.64858 > 170.106.162.74.10130: UDP, length 18
22:14:07.544150 IP 192.168.3.247.64858 > 170.106.162.74.10130: UDP, length 18
22:14:07.545965 IP 170.106.162.74.10130 > 192.168.3.247.64858: UDP, length 44
22:14:07.577136 IP 192.168.3.247.64858 > 170.106.162.74.10130: UDP, length 18
22:14:07.601369 IP 170.106.162.74.10130 > 192.168.3.247.64858: UDP, length 12
22:14:07.610644 IP 192.168.3.247.64858 > 170.106.162.74.10130: UDP, length 21
22:14:07.643760 IP 192.168.3.247.64858 > 170.106.162.74.10130: UDP, length 18
22:14:07.657191 IP 170.106.162.74.10130 > 192.168.3.247.64858: UDP, length 47
22:14:07.677689 IP 192.168.3.247.64858 > 170.106.162.74.10130: UDP, length 18
22:14:07.710360 IP 192.168.3.247.64858 > 170.106.162.74.10130: UDP, length 18
22:14:07.712301 IP 170.106.162.74.10130 > 192.168.3.247.64858: UDP, length 12
22:14:07.743884 IP 192.168.3.247.64858 > 170.106.162.74.10130: UDP, length 18
22:14:07.768537 IP 170.106.162.74.10130 > 192.168.3.247.64858: UDP, length 44
22:14:07.779031 IP 192.168.3.247.64858 > 170.106.162.74.10130: UDP, length 21
22:14:07.811228 IP 192.168.3.247.64858 > 170.106.162.74.10130: UDP, length 18
22:14:07.823889 IP 170.106.162.74.10130 > 192.168.3.247.64858: UDP, length 15
22:14:07.842754 IP DESKTOP-3Q7IHRH.lan.61269 > 239.255.255.250.1900: UDP, length 173
22:14:07.845247 IP 192.168.3.247.64858 > 170.106.162.74.10130: UDP, length 18
22:14:07.871438 IP DESKTOP-3Q7IHRH.lan.61270 > 239.255.255.250.1900: UDP, length 174
22:14:07.876680 IP 192.168.3.247.64858 > 170.106.162.74.10130: UDP, length 18
22:14:07.879642 IP 170.106.162.74.10130 > 192.168.3.247.64858: UDP, length 44
22:14:07.911241 IP 192.168.3.247.64858 > 170.106.162.74.10130: UDP, length 18
22:14:07.920444 IP 192.168.3.247.54541 > 49.51.231.117.20002: UDP, length 55
22:14:07.934923 IP 170.106.162.74.10130 > 192.168.3.247.64858: UDP, length 23
22:14:07.942628 IP 192.168.3.247.64858 > 170.106.162.74.10130: UDP, length 36
22:14:07.977098 IP 192.168.3.247.64858 > 170.106.162.74.10130: UDP, length 18
22:14:07.990624 IP 170.106.162.74.10130 > 192.168.3.247.64858: UDP, length 47
22:14:07.992984 IP 49.51.231.117.20002 > 192.168.3.247.54541: UDP, length 23
22:14:08.011954 IP 192.168.3.247.64858 > 170.106.162.74.10130: UDP, length 18
22:14:08.032403 IP 192.168.3.247.54541 > 49.51.231.117.20002: UDP, length 52
22:14:08.044171 IP 192.168.3.247.64858 > 170.106.162.74.10130: UDP, length 18
22:14:08.046537 IP 170.106.162.74.10130 > 192.168.3.247.64858: UDP, length 12
22:14:08.078686 IP 192.168.3.247.64858 > 170.106.162.74.10130: UDP, length 18
22:14:08.102050 IP 170.106.162.74.10130 > 192.168.3.247.64858: UDP, length 44
22:14:08.105490 IP 49.51.231.117.20002 > 192.168.3.247.54541: UDP, length 25
22:14:08.112504 IP 192.168.3.247.64858 > 170.106.162.74.10130: UDP, length 21
22:14:08.112519 IP 192.168.3.247.49950 > 49.51.67.140.17500: Flags [.], ack 58, win 16384, length 0
22:14:08.144432 IP 192.168.3.247.64858 > 170.106.162.74.10130: UDP, length 18
22:14:08.157361 IP 170.106.162.74.10130 > 192.168.3.247.64858: UDP, length 26
22:14:08.177304 IP 192.168.3.247.64858 > 170.106.162.74.10130: UDP, length 37
22:14:08.213169 IP 192.168.3.247.64858 > 170.106.162.74.10130: UDP, length 18
22:14:08.213553 IP 170.106.162.74.10130 > 192.168.3.247.64858: UDP, length 44
22:14:08.243905 IP 192.168.3.247.64858 > 170.106.162.74.10130: UDP, length 18
22:14:08.268546 IP 170.106.162.74.10130 > 192.168.3.247.64858: UDP, length 12
22:14:08.278645 IP 192.168.3.247.64858 > 170.106.162.74.10130: UDP, length 21
22:14:08.312688 IP 192.168.3.247.64858 > 170.106.162.74.10130: UDP, length 18
22:14:08.324458 IP 170.106.162.74.10130 > 192.168.3.247.64858: UDP, length 47
22:14:08.344188 IP 192.168.3.247.64858 > 170.106.162.74.10130: UDP, length 18
22:14:08.376055 IP 49.51.67.140.17500 > 192.168.3.247.49950: Flags [.], ack 57, win 28293, length 0
22:14:08.377738 IP 192.168.3.247.64858 > 170.106.162.74.10130: UDP, length 18
22:14:08.380289 IP 170.106.162.74.10130 > 192.168.3.247.64858: UDP, length 12
22:14:08.411891 IP 192.168.3.247.64858 > 170.106.162.74.10130: UDP, length 18
22:14:08.436004 IP 170.106.162.74.10130 > 192.168.3.247.64858: UDP, length 44
22:14:08.444359 IP 192.168.3.247.64858 > 170.106.162.74.10130: UDP, length 21
22:14:08.477096 IP 192.168.3.247.64858 > 170.106.162.74.10130: UDP, length 18
22:14:08.491314 IP 170.106.162.74.10130 > 192.168.3.247.64858: UDP, length 15
22:14:08.508192 IP DESKTOP-3Q7IHRH.lan.56756 > bh-in-f188.1e100.net.5228: Flags [.], seq 579709779:579709780, ack 786594585, win 513, length 1
22:14:08.510260 IP bh-in-f188.1e100.net.5228 > DESKTOP-3Q7IHRH.lan.56756: Flags [.], ack 1, win 265, options [nop,nop,sack 1 {0:1}], length 0
22:14:08.513007 IP 192.168.3.247.64858 > 170.106.162.74.10130: UDP, length 18
22:14:08.543697 IP 192.168.3.247.64858 > 170.106.162.74.10130: UDP, length 18
22:14:08.546907 IP 170.106.162.74.10130 > 192.168.3.247.64858: UDP, length 47
22:14:08.577739 IP 192.168.3.247.64858 > 170.106.162.74.10130: UDP, length 18
22:14:08.602780 IP 170.106.162.74.10130 > 192.168.3.247.64858: UDP, length 12
22:14:08.616155 IP 192.168.3.247.64858 > 170.106.162.74.10130: UDP, length 21
22:14:08.644184 IP 192.168.3.247.64858 > 170.106.162.74.10130: UDP, length 18
22:14:08.658136 IP 170.106.162.74.10130 > 192.168.3.247.64858: UDP, length 44
22:14:08.678047 IP 192.168.3.247.64858 > 170.106.162.74.10130: UDP, length 18
22:14:08.712426 IP 192.168.3.247.64858 > 170.106.162.74.10130: UDP, length 18
22:14:08.713604 IP 170.106.162.74.10130 > 192.168.3.247.64858: UDP, length 12
22:14:08.744511 IP 192.168.3.247.64858 > 170.106.162.74.10130: UDP, length 18
22:14:08.769878 IP 170.106.162.74.10130 > 192.168.3.247.64858: UDP, length 44
22:14:08.777069 IP 192.168.3.247.64858 > 170.106.162.74.10130: UDP, length 21
22:14:08.811899 IP 192.168.3.247.64858 > 170.106.162.74.10130: UDP, length 18
22:14:08.824918 IP 170.106.162.74.10130 > 192.168.3.247.64858: UDP, length 15
22:14:08.843670 IP 192.168.3.247.64858 > 170.106.162.74.10130: UDP, length 18
22:14:08.851521 IP DESKTOP-3Q7IHRH.lan.61269 > 239.255.255.250.1900: UDP, length 173
22:14:08.878094 IP 192.168.3.247.64858 > 170.106.162.74.10130: UDP, length 18
22:14:08.880621 IP 170.106.162.74.10130 > 192.168.3.247.64858: UDP, length 44
22:14:08.883651 IP DESKTOP-3Q7IHRH.lan.61270 > 239.255.255.250.1900: UDP, length 174
22:14:08.912317 IP 192.168.3.247.64858 > 170.106.162.74.10130: UDP, length 18
22:14:08.915985 IP 192.168.3.247.54541 > 49.51.231.117.20002: UDP, length 55
22:14:08.937216 IP 170.106.162.74.10130 > 192.168.3.247.64858: UDP, length 23
22:14:08.944133 IP 192.168.3.247.64858 > 170.106.162.74.10130: UDP, length 18
22:14:08.969819 IP server-108-156-107-124.ord56.r.cloudfront.net.443 > DESKTOP-3Q7IHRH.lan.56959: Flags [P.], seq 1761:2280, ack 237, win 2471, length 519
22:14:08.969829 IP server-108-156-107-124.ord56.r.cloudfront.net.443 > DESKTOP-3Q7IHRH.lan.56959: Flags [P.], seq 2280:2311, ack 237, win 2471, length 31
22:14:08.977681 IP 192.168.3.247.64858 > 170.106.162.74.10130: UDP, length 33
22:14:08.988483 IP 49.51.231.117.20002 > 192.168.3.247.54541: UDP, length 23
22:14:08.991925 IP 170.106.162.74.10130 > 192.168.3.247.64858: UDP, length 47
22:14:09.012488 IP 192.168.3.247.64858 > 170.106.162.74.10130: UDP, length 21
22:14:09.037193 IP 192.168.3.247.54541 > 49.51.231.117.20002: UDP, length 118
22:14:09.037210 IP 192.168.3.247.63751 > 49.51.41.170.20000: UDP, length 139
22:14:09.044145 IP 192.168.3.247.64858 > 170.106.162.74.10130: UDP, length 18
22:14:09.047397 IP 170.106.162.74.10130 > 192.168.3.247.64858: UDP, length 15
22:14:09.077221 IP 192.168.3.247.64858 > 170.106.162.74.10130: UDP, length 18
22:14:09.104190 IP 170.106.162.74.10130 > 192.168.3.247.64858: UDP, length 44
22:14:09.121883 IP 192.168.3.247.64858 > 170.106.162.74.10130: UDP, length 18
22:14:09.129331 IP DESKTOP-3Q7IHRH.lan.56959 > server-108-156-107-124.ord56.r.cloudfront.net.443: Flags [.], ack 2311, win 8311, length 0
22:14:09.129691 IP DESKTOP-3Q7IHRH.lan.56959 > server-108-156-107-124.ord56.r.cloudfront.net.443: Flags [P.], seq 237:272, ack 2311, win 8311, length 35
22:14:09.134168 IP DESKTOP-3Q7IHRH.lan.56959 > server-108-156-107-124.ord56.r.cloudfront.net.443: Flags [P.], seq 272:507, ack 2311, win 8311, length 235
22:14:09.142853 IP 192.168.3.247.64858 > 170.106.162.74.10130: UDP, length 18
22:14:09.147495 IP server-108-156-107-124.ord56.r.cloudfront.net.443 > DESKTOP-3Q7IHRH.lan.56959: Flags [.], ack 272, win 2471, length 0
22:14:09.151940 IP server-108-156-107-124.ord56.r.cloudfront.net.443 > DESKTOP-3Q7IHRH.lan.56959: Flags [.], ack 507, win 2471, length 0
22:14:09.159103 IP 170.106.162.74.10130 > 192.168.3.247.64858: UDP, length 23
22:14:09.177796 IP 192.168.3.247.64858 > 170.106.162.74.10130: UDP, length 40
22:14:09.212446 IP 192.168.3.247.64858 > 170.106.162.74.10130: UDP, length 18
22:14:09.215055 IP 170.106.162.74.10130 > 192.168.3.247.64858: UDP, length 44
22:14:09.246670 IP 192.168.3.247.64858 > 170.106.162.74.10130: UDP, length 18
22:14:09.270408 IP 170.106.162.74.10130 > 192.168.3.247.64858: UDP, length 12
22:14:09.277809 IP 192.168.3.247.64858 > 170.106.162.74.10130: UDP, length 21
22:14:09.312234 IP 192.168.3.247.64858 > 170.106.162.74.10130: UDP, length 18
22:14:09.326161 IP 170.106.162.74.10130 > 192.168.3.247.64858: UDP, length 47
22:14:09.345850 IP 192.168.3.247.64858 > 170.106.162.74.10130: UDP, length 18
22:14:09.376228 IP 192.168.3.247.64858 > 170.106.162.74.10130: UDP, length 18
22:14:09.381633 IP 170.106.162.74.10130 > 192.168.3.247.64858: UDP, length 15
22:14:09.411215 IP 192.168.3.247.64858 > 170.106.162.74.10130: UDP, length 18
22:14:09.434298 IP DESKTOP-3Q7IHRH.lan.59531 > iad66s01-in-f14.1e100.net.443: UDP, length 1250
22:14:09.436986 IP 170.106.162.74.10130 > 192.168.3.247.64858: UDP, length 44
22:14:09.440216 IP DESKTOP-3Q7IHRH.lan.59531 > iad66s01-in-f14.1e100.net.443: UDP, length 77
22:14:09.444040 IP iad66s01-in-f14.1e100.net.443 > DESKTOP-3Q7IHRH.lan.59531: UDP, length 1250
22:14:09.444049 IP iad66s01-in-f14.1e100.net.443 > DESKTOP-3Q7IHRH.lan.59531: UDP, length 622
22:14:09.444157 IP 192.168.3.247.64858 > 170.106.162.74.10130: UDP, length 21
22:14:09.449373 IP DESKTOP-3Q7IHRH.lan.59531 > iad66s01-in-f14.1e100.net.443: UDP, length 78
22:14:09.449388 IP DESKTOP-3Q7IHRH.lan.59531 > iad66s01-in-f14.1e100.net.443: UDP, length 33
22:14:09.449643 IP DESKTOP-3Q7IHRH.lan.59531 > iad66s01-in-f14.1e100.net.443: UDP, length 1246
22:14:09.449667 IP DESKTOP-3Q7IHRH.lan.59531 > iad66s01-in-f14.1e100.net.443: UDP, length 1246
22:14:09.449680 IP DESKTOP-3Q7IHRH.lan.59531 > iad66s01-in-f14.1e100.net.443: UDP, length 1250
22:14:09.449693 IP DESKTOP-3Q7IHRH.lan.59531 > iad66s01-in-f14.1e100.net.443: UDP, length 1250
22:14:09.449706 IP DESKTOP-3Q7IHRH.lan.59531 > iad66s01-in-f14.1e100.net.443: UDP, length 1250
22:14:09.449958 IP DESKTOP-3Q7IHRH.lan.59531 > iad66s01-in-f14.1e100.net.443: UDP, length 382
22:14:09.457038 IP iad66s01-in-f14.1e100.net.443 > DESKTOP-3Q7IHRH.lan.59531: UDP, length 99
22:14:09.458515 IP iad66s01-in-f14.1e100.net.443 > DESKTOP-3Q7IHRH.lan.59531: UDP, length 25
22:14:09.458994 IP iad66s01-in-f14.1e100.net.443 > DESKTOP-3Q7IHRH.lan.59531: UDP, length 29
22:14:09.461478 IP DESKTOP-3Q7IHRH.lan.59531 > iad66s01-in-f14.1e100.net.443: UDP, length 33
22:14:09.472515 IP iad66s01-in-f14.1e100.net.443 > DESKTOP-3Q7IHRH.lan.59531: UDP, length 907
22:14:09.475542 IP DESKTOP-3Q7IHRH.lan.59531 > iad66s01-in-f14.1e100.net.443: UDP, length 35
22:14:09.477656 IP 192.168.3.247.64858 > 170.106.162.74.10130: UDP, length 18
22:14:09.492497 IP 170.106.162.74.10130 > 192.168.3.247.64858: UDP, length 12
22:14:09.508187 IP iad66s01-in-f14.1e100.net.443 > DESKTOP-3Q7IHRH.lan.59531: UDP, length 25
22:14:09.513049 IP 192.168.3.247.64858 > 170.106.162.74.10130: UDP, length 18
22:14:09.543851 IP 192.168.3.247.64858 > 170.106.162.74.10130: UDP, length 18
22:14:09.548691 IP 170.106.162.74.10130 > 192.168.3.247.64858: UDP, length 47
22:14:09.577986 IP 192.168.3.247.64858 > 170.106.162.74.10130: UDP, length 18
22:14:09.603805 IP 170.106.162.74.10130 > 192.168.3.247.64858: UDP, length 12
22:14:09.612366 IP 192.168.3.247.64858 > 170.106.162.74.10130: UDP, length 18
22:14:09.644539 IP 192.168.3.247.64858 > 170.106.162.74.10130: UDP, length 18
22:14:09.659927 IP 170.106.162.74.10130 > 192.168.3.247.64858: UDP, length 44
22:14:09.677415 IP 192.168.3.247.64858 > 170.106.162.74.10130: UDP, length 21
22:14:09.711657 IP 192.168.3.247.64858 > 170.106.162.74.10130: UDP, length 18
22:14:09.715105 IP 170.106.162.74.10130 > 192.168.3.247.64858: UDP, length 15
22:14:09.744666 IP 192.168.3.247.64858 > 170.106.162.74.10130: UDP, length 18
22:14:09.770901 IP 170.106.162.74.10130 > 192.168.3.247.64858: UDP, length 44
22:14:09.776976 IP 192.168.3.247.64858 > 170.106.162.74.10130: UDP, length 18
22:14:09.812278 IP 192.168.3.247.64858 > 170.106.162.74.10130: UDP, length 18
22:14:09.826570 IP 170.106.162.74.10130 > 192.168.3.247.64858: UDP, length 23
22:14:09.844723 IP 192.168.3.247.64858 > 170.106.162.74.10130: UDP, length 21
22:14:09.864569 IP DESKTOP-3Q7IHRH.lan.61269 > 239.255.255.250.1900: UDP, length 173
22:14:09.867248 IP 192.168.3.247.51520 > 49.51.180.215.17000: UDP, length 5
22:14:09.877011 IP 192.168.3.247.64858 > 170.106.162.74.10130: UDP, length 18
22:14:09.882244 IP 170.106.162.74.10130 > 192.168.3.247.64858: UDP, length 47
22:14:09.895192 IP DESKTOP-3Q7IHRH.lan.61270 > 239.255.255.250.1900: UDP, length 174
22:14:09.912381 IP 192.168.3.247.64858 > 170.106.162.74.10130: UDP, length 18
22:14:09.921001 IP 192.168.3.247.54541 > 49.51.231.117.20002: UDP, length 55
22:14:09.935875 IP 49.51.180.215.17000 > 192.168.3.247.51520: UDP, length 8
22:14:09.937634 IP 170.106.162.74.10130 > 192.168.3.247.64858: UDP, length 23
22:14:09.940439 IP 192.168.3.247.51520 > 49.51.180.215.17000: UDP, length 5
22:14:09.944128 IP 192.168.3.247.64858 > 170.106.162.74.10130: UDP, length 18
22:14:09.977406 IP 192.168.3.247.64858 > 170.106.162.74.10130: UDP, length 33
22:14:09.993267 IP 170.106.162.74.10130 > 192.168.3.247.64858: UDP, length 44
22:14:09.993546 IP 49.51.231.117.20002 > 192.168.3.247.54541: UDP, length 23
22:14:10.009080 IP 49.51.180.215.17000 > 192.168.3.247.51520: UDP, length 8
22:14:10.011655 IP 192.168.3.247.64858 > 170.106.162.74.10130: UDP, length 21
22:14:10.016265 IP 192.168.3.247.63751 > 49.51.41.170.20000: UDP, length 50
22:14:10.016282 IP 192.168.3.247.63751 > 49.51.41.170.20000: UDP, length 52
22:14:10.043895 IP 192.168.3.247.64858 > 170.106.162.74.10130: UDP, length 18
22:14:10.048820 IP 170.106.162.74.10130 > 192.168.3.247.64858: UDP, length 15
22:14:10.077509 IP 192.168.3.247.64858 > 170.106.162.74.10130: UDP, length 18
22:14:10.087201 IP 49.51.41.170.20000 > 192.168.3.247.63751: UDP, length 25
22:14:10.105133 IP 170.106.162.74.10130 > 192.168.3.247.64858: UDP, length 44
22:14:10.112160 IP 192.168.3.247.64858 > 170.106.162.74.10130: UDP, length 18
22:14:10.144335 IP 192.168.3.247.64858 > 170.106.162.74.10130: UDP, length 18
22:14:10.160566 IP 170.106.162.74.10130 > 192.168.3.247.64858: UDP, length 23
22:14:10.177882 IP 192.168.3.247.64858 > 170.106.162.74.10130: UDP, length 40
22:14:10.212533 IP 192.168.3.247.64858 > 170.106.162.74.10130: UDP, length 18
22:14:10.215798 IP 170.106.162.74.10130 > 192.168.3.247.64858: UDP, length 47
22:14:10.244438 IP 192.168.3.247.64858 > 170.106.162.74.10130: UDP, length 18
22:14:10.271310 IP 170.106.162.74.10130 > 192.168.3.247.64858: UDP, length 12
22:14:10.277378 IP 192.168.3.247.64858 > 170.106.162.74.10130: UDP, length 18
22:14:10.311871 IP 192.168.3.247.64858 > 170.106.162.74.10130: UDP, length 18
22:14:10.327220 IP 170.106.162.74.10130 > 192.168.3.247.64858: UDP, length 44
22:14:10.344293 IP 192.168.3.247.64858 > 170.106.162.74.10130: UDP, length 21
22:14:10.377642 IP 192.168.3.247.64858 > 170.106.162.74.10130: UDP, length 18
22:14:10.382614 IP 170.106.162.74.10130 > 192.168.3.247.64858: UDP, length 15
22:14:10.412201 IP 192.168.3.247.64858 > 170.106.162.74.10130: UDP, length 18
22:14:10.439007 IP 170.106.162.74.10130 > 192.168.3.247.64858: UDP, length 44
22:14:10.447300 IP 192.168.3.247.64858 > 170.106.162.74.10130: UDP, length 18
22:14:10.477697 IP 192.168.3.247.64858 > 170.106.162.74.10130: UDP, length 18
22:14:10.494357 IP 170.106.162.74.10130 > 192.168.3.247.64858: UDP, length 12
22:14:10.511987 IP 192.168.3.247.64858 > 170.106.162.74.10130: UDP, length 21
22:14:10.544500 IP 192.168.3.247.64858 > 170.106.162.74.10130: UDP, length 18
22:14:10.549712 IP 170.106.162.74.10130 > 192.168.3.247.64858: UDP, length 47
22:14:10.577424 IP 192.168.3.247.64858 > 170.106.162.74.10130: UDP, length 18
22:14:10.605195 IP 170.106.162.74.10130 > 192.168.3.247.64858: UDP, length 12
22:14:10.611890 IP 192.168.3.247.64858 > 170.106.162.74.10130: UDP, length 18
22:14:10.644087 IP 192.168.3.247.64858 > 170.106.162.74.10130: UDP, length 18
22:14:10.661057 IP 170.106.162.74.10130 > 192.168.3.247.64858: UDP, length 44
22:14:10.677229 IP 192.168.3.247.64858 > 170.106.162.74.10130: UDP, length 21
22:14:10.710871 IP 192.168.3.247.64858 > 170.106.162.74.10130: UDP, length 18
22:14:10.716410 IP 170.106.162.74.10130 > 192.168.3.247.64858: UDP, length 15
22:14:10.744302 IP 192.168.3.247.64858 > 170.106.162.74.10130: UDP, length 18
22:14:10.772205 IP 170.106.162.74.10130 > 192.168.3.247.64858: UDP, length 44
22:14:10.778592 IP 192.168.3.247.64858 > 170.106.162.74.10130: UDP, length 18
22:14:10.811758 IP 192.168.3.247.64858 > 170.106.162.74.10130: UDP, length 18
22:14:10.827632 IP 170.106.162.74.10130 > 192.168.3.247.64858: UDP, length 12
22:14:10.843257 IP 192.168.3.247.64858 > 170.106.162.74.10130: UDP, length 21
22:14:10.874488 IP DESKTOP-3Q7IHRH.lan.61269 > 239.255.255.250.1900: UDP, length 173
22:14:10.877593 IP 192.168.3.247.64858 > 170.106.162.74.10130: UDP, length 18
22:14:10.883946 IP 170.106.162.74.10130 > 192.168.3.247.64858: UDP, length 47
22:14:10.907022 IP DESKTOP-3Q7IHRH.lan.61270 > 239.255.255.250.1900: UDP, length 174
22:14:10.907315 IP 192.168.3.247.54541 > 49.51.231.117.20002: UDP, length 55
22:14:10.911612 IP 192.168.3.247.64858 > 170.106.162.74.10130: UDP, length 18
22:14:10.939579 IP 170.106.162.74.10130 > 192.168.3.247.64858: UDP, length 23
22:14:10.943721 IP 192.168.3.247.64858 > 170.106.162.74.10130: UDP, length 18
22:14:10.977248 IP 192.168.3.247.64858 > 170.106.162.74.10130: UDP, length 33
22:14:10.979803 IP 49.51.231.117.20002 > 192.168.3.247.54541: UDP, length 23
22:14:10.994811 IP 170.106.162.74.10130 > 192.168.3.247.64858: UDP, length 44
22:14:11.011203 IP 192.168.3.247.64858 > 170.106.162.74.10130: UDP, length 21
22:14:11.019973 IP 192.168.3.247.54541 > 49.51.231.117.20002: UDP, length 50
22:14:11.019989 IP 192.168.3.247.54541 > 49.51.231.117.20002: UDP, length 52
22:14:11.044431 IP 192.168.3.247.64858 > 170.106.162.74.10130: UDP, length 18
22:14:11.050680 IP 170.106.162.74.10130 > 192.168.3.247.64858: UDP, length 15
22:14:11.078677 IP 192.168.3.247.64858 > 170.106.162.74.10130: UDP, length 18
22:14:11.092506 IP 49.51.231.117.20002 > 192.168.3.247.54541: UDP, length 25
22:14:11.106154 IP 170.106.162.74.10130 > 192.168.3.247.64858: UDP, length 44
22:14:11.116432 IP 192.168.3.247.64858 > 170.106.162.74.10130: UDP, length 18
22:14:11.144444 IP 192.168.3.247.64858 > 170.106.162.74.10130: UDP, length 18
22:14:11.161949 IP 170.106.162.74.10130 > 192.168.3.247.64858: UDP, length 23
22:14:11.178127 IP 192.168.3.247.64858 > 170.106.162.74.10130: UDP, length 40
22:14:11.213452 IP 192.168.3.247.64858 > 170.106.162.74.10130: UDP, length 18
22:14:11.217298 IP 170.106.162.74.10130 > 192.168.3.247.64858: UDP, length 47
22:14:11.244052 IP 192.168.3.247.64858 > 170.106.162.74.10130: UDP, length 18
22:14:11.272771 IP 170.106.162.74.10130 > 192.168.3.247.64858: UDP, length 12
22:14:11.277330 IP 192.168.3.247.64858 > 170.106.162.74.10130: UDP, length 18
22:14:11.312272 IP 192.168.3.247.64858 > 170.106.162.74.10130: UDP, length 18
22:14:11.328965 IP 170.106.162.74.10130 > 192.168.3.247.64858: UDP, length 44
22:14:11.344426 IP 192.168.3.247.64858 > 170.106.162.74.10130: UDP, length 21
22:14:11.377726 IP 192.168.3.247.64858 > 170.106.162.74.10130: UDP, length 18
22:14:11.383956 IP 170.106.162.74.10130 > 192.168.3.247.64858: UDP, length 15
22:14:11.412444 IP 192.168.3.247.64858 > 170.106.162.74.10130: UDP, length 18
22:14:11.439787 IP 170.106.162.74.10130 > 192.168.3.247.64858: UDP, length 44
22:14:11.444348 IP 192.168.3.247.64858 > 170.106.162.74.10130: UDP, length 18
22:14:11.477468 IP 192.168.3.247.64858 > 170.106.162.74.10130: UDP, length 18
22:14:11.495779 IP 170.106.162.74.10130 > 192.168.3.247.64858: UDP, length 12
22:14:11.511781 IP 192.168.3.247.64858 > 170.106.162.74.10130: UDP, length 21
22:14:11.543866 IP 192.168.3.247.64858 > 170.106.162.74.10130: UDP, length 18
22:14:11.551052 IP 170.106.162.74.10130 > 192.168.3.247.64858: UDP, length 47
22:14:11.578023 IP 192.168.3.247.64858 > 170.106.162.74.10130: UDP, length 18
22:14:11.606566 IP 170.106.162.74.10130 > 192.168.3.247.64858: UDP, length 12
22:14:11.612109 IP 192.168.3.247.64858 > 170.106.162.74.10130: UDP, length 18
22:14:11.644420 IP 192.168.3.247.64858 > 170.106.162.74.10130: UDP, length 18
22:14:11.662357 IP 170.106.162.74.10130 > 192.168.3.247.64858: UDP, length 44
22:14:11.677697 IP 192.168.3.247.64858 > 170.106.162.74.10130: UDP, length 21
22:14:11.712190 IP 192.168.3.247.64858 > 170.106.162.74.10130: UDP, length 18
22:14:11.717948 IP 170.106.162.74.10130 > 192.168.3.247.64858: UDP, length 15
22:14:11.730663 IP 192.168.3.247.49944 > 129.226.3.232.443: Flags [P.], seq 1896648091:1896648900, ack 1051078833, win 4096, length 809
22:14:11.743940 IP 192.168.3.247.64858 > 170.106.162.74.10130: UDP, length 18
22:14:11.774187 IP 170.106.162.74.10130 > 192.168.3.247.64858: UDP, length 44
22:14:11.777442 IP 192.168.3.247.64858 > 170.106.162.74.10130: UDP, length 18
22:14:11.812428 IP 192.168.3.247.64858 > 170.106.162.74.10130: UDP, length 18
22:14:11.829091 IP 170.106.162.74.10130 > 192.168.3.247.64858: UDP, length 12
22:14:11.844041 IP 192.168.3.247.64858 > 170.106.162.74.10130: UDP, length 21
22:14:11.878624 IP 192.168.3.247.64858 > 170.106.162.74.10130: UDP, length 18
22:14:11.884886 IP 170.106.162.74.10130 > 192.168.3.247.64858: UDP, length 47
22:14:11.912261 IP 192.168.3.247.64858 > 170.106.162.74.10130: UDP, length 18
22:14:11.916874 IP 192.168.3.247.54541 > 49.51.231.117.20002: UDP, length 55
22:14:11.940878 IP 170.106.162.74.10130 > 192.168.3.247.64858: UDP, length 23
22:14:11.944661 IP 192.168.3.247.64858 > 170.106.162.74.10130: UDP, length 18
22:14:11.976882 IP 192.168.3.247.64858 > 170.106.162.74.10130: UDP, length 33
22:14:11.989427 IP 49.51.231.117.20002 > 192.168.3.247.54541: UDP, length 23
22:14:11.996110 IP 170.106.162.74.10130 > 192.168.3.247.64858: UDP, length 44
22:14:12.007076 IP 129.226.3.232.443 > 192.168.3.247.49944: Flags [.], ack 809, win 32406, length 0
22:14:12.011308 IP 192.168.3.247.49944 > 129.226.3.232.443: Flags [P.], seq 809:1113, ack 1, win 4096, length 304
22:14:12.014547 IP 192.168.3.247.64858 > 170.106.162.74.10130: UDP, length 21
22:14:12.044517 IP 192.168.3.247.64858 > 170.106.162.74.10130: UDP, length 18
22:14:12.052342 IP 170.106.162.74.10130 > 192.168.3.247.64858: UDP, length 15
22:14:12.054035 IP 192.168.3.247.49950 > 49.51.67.140.17500: Flags [P.], seq 57:114, ack 58, win 16384, length 57
22:14:12.077327 IP 192.168.3.247.64858 > 170.106.162.74.10130: UDP, length 18
22:14:12.107501 IP 170.106.162.74.10130 > 192.168.3.247.64858: UDP, length 44
22:14:12.112468 IP 192.168.3.247.64858 > 170.106.162.74.10130: UDP, length 18
22:14:12.144710 IP 192.168.3.247.64858 > 170.106.162.74.10130: UDP, length 18
22:14:12.163088 IP 170.106.162.74.10130 > 192.168.3.247.64858: UDP, length 23
22:14:12.178055 IP 192.168.3.247.64858 > 170.106.162.74.10130: UDP, length 40
22:14:12.211919 IP 192.168.3.247.64858 > 170.106.162.74.10130: UDP, length 73
22:14:12.218799 IP 170.106.162.74.10130 > 192.168.3.247.64858: UDP, length 47
22:14:12.243442 IP 192.168.3.247.64858 > 170.106.162.74.10130: UDP, length 18
22:14:12.243975 IP 129.226.3.232.443 > 192.168.3.247.49944: Flags [.], ack 1113, win 32406, length 0
22:14:12.272374 IP server-108-156-107-124.ord56.r.cloudfront.net.443 > DESKTOP-3Q7IHRH.lan.56959: Flags [P.], seq 2311:2829, ack 507, win 2471, length 518
22:14:12.272383 IP server-108-156-107-124.ord56.r.cloudfront.net.443 > DESKTOP-3Q7IHRH.lan.56959: Flags [P.], seq 2829:2860, ack 507, win 2471, length 31
22:14:12.274231 IP 170.106.162.74.10130 > 192.168.3.247.64858: UDP, length 12
22:14:12.279418 IP 192.168.3.247.64858 > 170.106.162.74.10130: UDP, length 18
22:14:12.311009 IP 192.168.3.247.64858 > 170.106.162.74.10130: UDP, length 18
22:14:12.320141 IP 49.51.67.140.17500 > 192.168.3.247.49950: Flags [P.], seq 58:115, ack 114, win 28293, length 57
22:14:12.324757 IP 192.168.3.247.49950 > 49.51.67.140.17500: Flags [.], ack 115, win 16383, length 0
22:14:12.329904 IP 170.106.162.74.10130 > 192.168.3.247.64858: UDP, length 44
22:14:12.343544 IP 192.168.3.247.64858 > 170.106.162.74.10130: UDP, length 21
22:14:12.376915 IP 192.168.3.247.64858 > 170.106.162.74.10130: UDP, length 18
22:14:12.385818 IP 170.106.162.74.10130 > 192.168.3.247.64858: UDP, length 15
22:14:12.406523 IP DESKTOP-3Q7IHRH.lan.56959 > server-108-156-107-124.ord56.r.cloudfront.net.443: Flags [.], ack 2860, win 8309, length 0
22:14:12.411337 IP DESKTOP-3Q7IHRH.lan.56959 > server-108-156-107-124.ord56.r.cloudfront.net.443: Flags [P.], seq 507:743, ack 2860, win 8309, length 236
22:14:12.411742 IP 192.168.3.247.64858 > 170.106.162.74.10130: UDP, length 18
22:14:12.429162 IP server-108-156-107-124.ord56.r.cloudfront.net.443 > DESKTOP-3Q7IHRH.lan.56959: Flags [.], ack 743, win 2471, length 0
22:14:12.441369 IP 170.106.162.74.10130 > 192.168.3.247.64858: UDP, length 44
22:14:12.444097 IP 192.168.3.247.64858 > 170.106.162.74.10130: UDP, length 18
22:14:12.478455 IP 192.168.3.247.64858 > 170.106.162.74.10130: UDP, length 18
22:14:12.496642 IP 170.106.162.74.10130 > 192.168.3.247.64858: UDP, length 12
22:14:12.512071 IP 192.168.3.247.64858 > 170.106.162.74.10130: UDP, length 21
22:14:12.544766 IP 192.168.3.247.64858 > 170.106.162.74.10130: UDP, length 18
22:14:12.552835 IP 170.106.162.74.10130 > 192.168.3.247.64858: UDP, length 47
22:14:12.578131 IP 192.168.3.247.64858 > 170.106.162.74.10130: UDP, length 18
22:14:12.607907 IP 170.106.162.74.10130 > 192.168.3.247.64858: UDP, length 12
22:14:12.612218 IP 192.168.3.247.64858 > 170.106.162.74.10130: UDP, length 18
22:14:12.644915 IP 192.168.3.247.64858 > 170.106.162.74.10130: UDP, length 18
22:14:12.663937 IP 170.106.162.74.10130 > 192.168.3.247.64858: UDP, length 44
22:14:12.677626 IP 192.168.3.247.64858 > 170.106.162.74.10130: UDP, length 21
22:14:12.713357 IP 192.168.3.247.64858 > 170.106.162.74.10130: UDP, length 18
22:14:12.719569 IP 170.106.162.74.10130 > 192.168.3.247.64858: UDP, length 15
22:14:12.743259 IP 192.168.3.247.64858 > 170.106.162.74.10130: UDP, length 18
22:14:12.774934 IP 170.106.162.74.10130 > 192.168.3.247.64858: UDP, length 44
22:14:12.778275 IP 192.168.3.247.64858 > 170.106.162.74.10130: UDP, length 18
22:14:12.813393 IP 192.168.3.247.64858 > 170.106.162.74.10130: UDP, length 18
22:14:12.831038 IP 170.106.162.74.10130 > 192.168.3.247.64858: UDP, length 12
22:14:12.844713 IP 192.168.3.247.64858 > 170.106.162.74.10130: UDP, length 21
22:14:12.874368 IP DESKTOP-3Q7IHRH.lan.58503 > iad23s72-in-f10.1e100.net.443: UDP, length 33
22:14:12.874384 IP DESKTOP-3Q7IHRH.lan.63500 > iad23s26-in-f206.1e100.net.443: UDP, length 33
22:14:12.878627 IP iad23s72-in-f10.1e100.net.443 > DESKTOP-3Q7IHRH.lan.58503: UDP, length 26
22:14:12.878646 IP 192.168.3.247.64858 > 170.106.162.74.10130: UDP, length 18
22:14:12.883304 IP iad23s26-in-f206.1e100.net.443 > DESKTOP-3Q7IHRH.lan.63500: UDP, length 26
22:14:12.886227 IP 170.106.162.74.10130 > 192.168.3.247.64858: UDP, length 47
22:14:12.912438 IP 192.168.3.247.64858 > 170.106.162.74.10130: UDP, length 18
22:14:12.920268 IP 192.168.3.247.54541 > 49.51.231.117.20002: UDP, length 55
22:14:12.941859 IP 170.106.162.74.10130 > 192.168.3.247.64858: UDP, length 23
22:14:12.944681 IP 192.168.3.247.64858 > 170.106.162.74.10130: UDP, length 18
22:14:12.977824 IP 192.168.3.247.64858 > 170.106.162.74.10130: UDP, length 33
22:14:12.993171 IP 49.51.231.117.20002 > 192.168.3.247.54541: UDP, length 23
22:14:12.997454 IP 170.106.162.74.10130 > 192.168.3.247.64858: UDP, length 44
22:14:13.011125 IP 192.168.3.247.64858 > 170.106.162.74.10130: UDP, length 21
22:14:13.031126 IP 192.168.3.247.63751 > 49.51.41.170.20000: UDP, length 52
22:14:13.044334 IP 192.168.3.247.64858 > 170.106.162.74.10130: UDP, length 18
22:14:13.052964 IP 170.106.162.74.10130 > 192.168.3.247.64858: UDP, length 15
22:14:13.060422 IP 192.168.3.247.49950 > 49.51.67.140.17500: Flags [.], ack 115, win 16384, length 0
22:14:13.077926 IP 192.168.3.247.64858 > 170.106.162.74.10130: UDP, length 18
22:14:13.102115 IP 49.51.41.170.20000 > 192.168.3.247.63751: UDP, length 25
22:14:13.109358 IP 170.106.162.74.10130 > 192.168.3.247.64858: UDP, length 44
22:14:13.113433 IP 192.168.3.247.64858 > 170.106.162.74.10130: UDP, length 18
22:14:13.144527 IP 192.168.3.247.64858 > 170.106.162.74.10130: UDP, length 18
22:14:13.164228 IP 170.106.162.74.10130 > 192.168.3.247.64858: UDP, length 23
22:14:13.174128 ARP, Request who-has 192.168.3.167 tell OpenWrt.lan, length 28
22:14:13.178167 IP 192.168.3.247.64858 > 170.106.162.74.10130: UDP, length 40
22:14:13.211331 IP 192.168.3.247.64858 > 170.106.162.74.10130: UDP, length 18
22:14:13.220544 IP 170.106.162.74.10130 > 192.168.3.247.64858: UDP, length 47
22:14:13.232506 IP DESKTOP-3Q7IHRH.lan.56710 > 52.113.207.0.443: Flags [P.], seq 2905397996:2905398054, ack 712997059, win 513, length 58
22:14:13.244946 IP 192.168.3.247.64858 > 170.106.162.74.10130: UDP, length 18
22:14:13.274573 IP 52.113.207.0.443 > DESKTOP-3Q7IHRH.lan.56710: Flags [P.], seq 1:48, ack 58, win 2050, length 47
22:14:13.275853 IP 170.106.162.74.10130 > 192.168.3.247.64858: UDP, length 12
22:14:13.277661 IP 192.168.3.247.64858 > 170.106.162.74.10130: UDP, length 18
22:14:13.311276 IP 192.168.3.247.64858 > 170.106.162.74.10130: UDP, length 18
22:14:13.323964 IP 49.51.67.140.17500 > 192.168.3.247.49950: Flags [.], ack 114, win 28293, length 0
22:14:13.325474 IP DESKTOP-3Q7IHRH.lan.56710 > 52.113.207.0.443: Flags [.], ack 48, win 513, length 0
