13:42:07.468255 IP ec2-3-141-212-7.us-east-2.compute.amazonaws.com.443 > hubv2-d052a8a7feff0001.lan.45958: Flags [.], ack 4165527931, win 21, options [nop,nop,TS val 3549339875 ecr 105993], length 0
13:42:07.468452 IP hubv2-d052a8a7feff0001.lan.45958 > ec2-3-141-212-7.us-east-2.compute.amazonaws.com.443: Flags [.], ack 1, win 2668, options [nop,nop,TS val 107624 ecr 3549323573], length 0
13:42:16.226713 IP hubv2-d052a8a7feff0001.lan.46249 > OpenWrt.lan.53: 48552+ A? api.smartthings.com. (37)
13:42:16.239275 IP OpenWrt.lan.53 > hubv2-d052a8a7feff0001.lan.46249: 48552 5/0/0 A 52.205.2.10, A 54.161.223.90, A 34.231.181.220, A 34.234.133.142, A 44.194.133.196 (117)
13:42:16.241454 IP hubv2-d052a8a7feff0001.lan.50112 > ec2-52-205-2-10.compute-1.amazonaws.com.443: Flags [S], seq 120572126, win 29200, options [mss 1460,sackOK,TS val 108501 ecr 0,nop,wscale 6], length 0
13:42:16.257787 IP ec2-52-205-2-10.compute-1.amazonaws.com.443 > hubv2-d052a8a7feff0001.lan.50112: Flags [S.], seq 3920418521, ack 120572127, win 26847, options [mss 1460,sackOK,TS val 2811112050 ecr 108501,nop,wscale 8], length 0
13:42:16.258039 IP hubv2-d052a8a7feff0001.lan.50112 > ec2-52-205-2-10.compute-1.amazonaws.com.443: Flags [.], ack 1, win 457, options [nop,nop,TS val 108503 ecr 2811112050], length 0
13:42:16.258400 IP hubv2-d052a8a7feff0001.lan.50112 > ec2-52-205-2-10.compute-1.amazonaws.com.443: Flags [P.], seq 1:121, ack 1, win 457, options [nop,nop,TS val 108503 ecr 2811112050], length 120
13:42:16.277827 IP ec2-52-205-2-10.compute-1.amazonaws.com.443 > hubv2-d052a8a7feff0001.lan.50112: Flags [.], ack 121, win 105, options [nop,nop,TS val 2811112070 ecr 108503], length 0
13:42:16.278484 IP ec2-52-205-2-10.compute-1.amazonaws.com.443 > hubv2-d052a8a7feff0001.lan.50112: Flags [R.], seq 1, ack 121, win 105, options [nop,nop,TS val 2811112070 ecr 108503], length 0
13:42:19.979705 IP hubv2-d052a8a7feff0001.lan.58229 > OpenWrt.lan.53: 1082+ A? api.smartthings.com. (37)
13:42:19.981054 IP OpenWrt.lan.53 > hubv2-d052a8a7feff0001.lan.58229: 1082 5/0/0 A 44.194.133.196, A 34.234.133.142, A 34.231.181.220, A 54.161.223.90, A 52.205.2.10 (117)
13:42:19.981330 IP hubv2-d052a8a7feff0001.lan.58229 > OpenWrt.lan.53: 2609+ AAAA? api.smartthings.com. (37)
13:42:19.981804 IP OpenWrt.lan.53 > hubv2-d052a8a7feff0001.lan.58229: 2609 0/0/0 (37)
13:42:19.983067 IP hubv2-d052a8a7feff0001.lan.38940 > ec2-44-194-133-196.compute-1.amazonaws.com.443: Flags [S], seq 1546057096, win 29200, options [mss 1460,sackOK,TS val 108875 ecr 0,nop,wscale 6], length 0
13:42:19.999546 IP ec2-44-194-133-196.compute-1.amazonaws.com.443 > hubv2-d052a8a7feff0001.lan.38940: Flags [S.], seq 2126850817, ack 1546057097, win 26847, options [mss 1460,sackOK,TS val 64868767 ecr 108875,nop,wscale 8], length 0
13:42:20.000473 IP hubv2-d052a8a7feff0001.lan.38940 > ec2-44-194-133-196.compute-1.amazonaws.com.443: Flags [.], ack 1, win 457, options [nop,nop,TS val 108877 ecr 64868767], length 0
13:42:20.118956 IP hubv2-d052a8a7feff0001.lan.38940 > ec2-44-194-133-196.compute-1.amazonaws.com.443: Flags [P.], seq 1:238, ack 1, win 457, options [nop,nop,TS val 108889 ecr 64868767], length 237
13:42:20.137614 IP ec2-44-194-133-196.compute-1.amazonaws.com.443 > hubv2-d052a8a7feff0001.lan.38940: Flags [.], ack 238, win 110, options [nop,nop,TS val 64868905 ecr 108889], length 0
13:42:20.139513 IP ec2-44-194-133-196.compute-1.amazonaws.com.443 > hubv2-d052a8a7feff0001.lan.38940: Flags [.], seq 1:1449, ack 238, win 110, options [nop,nop,TS val 64868906 ecr 108889], length 1448
13:42:20.139825 IP hubv2-d052a8a7feff0001.lan.38940 > ec2-44-194-133-196.compute-1.amazonaws.com.443: Flags [.], ack 1449, win 502, options [nop,nop,TS val 108891 ecr 64868906], length 0
13:42:20.141020 IP ec2-44-194-133-196.compute-1.amazonaws.com.443 > hubv2-d052a8a7feff0001.lan.38940: Flags [.], seq 1449:2897, ack 238, win 110, options [nop,nop,TS val 64868906 ecr 108889], length 1448
13:42:20.141338 IP hubv2-d052a8a7feff0001.lan.38940 > ec2-44-194-133-196.compute-1.amazonaws.com.443: Flags [.], ack 2897, win 547, options [nop,nop,TS val 108891 ecr 64868906], length 0
13:42:20.142399 IP ec2-44-194-133-196.compute-1.amazonaws.com.443 > hubv2-d052a8a7feff0001.lan.38940: Flags [P.], seq 2897:3315, ack 238, win 110, options [nop,nop,TS val 64868906 ecr 108889], length 418
13:42:20.142585 IP hubv2-d052a8a7feff0001.lan.38940 > ec2-44-194-133-196.compute-1.amazonaws.com.443: Flags [.], ack 3315, win 592, options [nop,nop,TS val 108891 ecr 64868906], length 0
13:42:20.152071 IP hubv2-d052a8a7feff0001.lan.38940 > ec2-44-194-133-196.compute-1.amazonaws.com.443: Flags [P.], seq 238:313, ack 3315, win 592, options [nop,nop,TS val 108892 ecr 64868906], length 75
13:42:20.152312 IP hubv2-d052a8a7feff0001.lan.38940 > ec2-44-194-133-196.compute-1.amazonaws.com.443: Flags [P.], seq 313:319, ack 3315, win 592, options [nop,nop,TS val 108892 ecr 64868906], length 6
13:42:20.152313 IP hubv2-d052a8a7feff0001.lan.38940 > ec2-44-194-133-196.compute-1.amazonaws.com.443: Flags [P.], seq 319:364, ack 3315, win 592, options [nop,nop,TS val 108892 ecr 64868906], length 45
13:42:20.171753 IP ec2-44-194-133-196.compute-1.amazonaws.com.443 > hubv2-d052a8a7feff0001.lan.38940: Flags [.], ack 364, win 110, options [nop,nop,TS val 64868939 ecr 108892], length 0
13:42:20.172825 IP ec2-44-194-133-196.compute-1.amazonaws.com.443 > hubv2-d052a8a7feff0001.lan.38940: Flags [P.], seq 3315:3366, ack 364, win 110, options [nop,nop,TS val 64868939 ecr 108892], length 51
13:42:20.179877 IP hubv2-d052a8a7feff0001.lan.38940 > ec2-44-194-133-196.compute-1.amazonaws.com.443: Flags [P.], seq 364:495, ack 3366, win 592, options [nop,nop,TS val 108895 ecr 64868939], length 131
13:42:20.195932 IP ec2-44-194-133-196.compute-1.amazonaws.com.443 > hubv2-d052a8a7feff0001.lan.38940: Flags [P.], seq 3366:3565, ack 495, win 114, options [nop,nop,TS val 64868962 ecr 108895], length 199
13:42:20.197040 IP hubv2-d052a8a7feff0001.lan.38940 > ec2-44-194-133-196.compute-1.amazonaws.com.443: Flags [P.], seq 495:526, ack 3565, win 638, options [nop,nop,TS val 108897 ecr 64868962], length 31
13:42:20.207782 IP hubv2-d052a8a7feff0001.lan.38940 > ec2-44-194-133-196.compute-1.amazonaws.com.443: Flags [F.], seq 526, ack 3565, win 638, options [nop,nop,TS val 108898 ecr 64868962], length 0
13:42:20.212488 IP ec2-44-194-133-196.compute-1.amazonaws.com.443 > hubv2-d052a8a7feff0001.lan.38940: Flags [F.], seq 3565, ack 526, win 114, options [nop,nop,TS val 64868979 ecr 108897], length 0
13:42:20.213191 IP hubv2-d052a8a7feff0001.lan.38940 > ec2-44-194-133-196.compute-1.amazonaws.com.443: Flags [.], ack 3566, win 638, options [nop,nop,TS val 108898 ecr 64868979], length 0
13:42:20.221611 IP ec2-44-194-133-196.compute-1.amazonaws.com.443 > hubv2-d052a8a7feff0001.lan.38940: Flags [.], ack 527, win 114, options [nop,nop,TS val 64868989 ecr 108898], length 0
13:42:21.312870 ARP, Request who-has hubv2-d052a8a7feff0001.lan tell OpenWrt.lan, length 28
13:42:21.313899 ARP, Reply hubv2-d052a8a7feff0001.lan is-at d0:52:a8:a7:fe:0c (oui Unknown), length 46
13:42:22.146295 IP hubv2-d052a8a7feff0001.lan.45958 > ec2-3-141-212-7.us-east-2.compute.amazonaws.com.443: Flags [P.], seq 1:46, ack 1, win 2668, options [nop,nop,TS val 109092 ecr 3549323573], length 45
13:42:22.173492 IP ec2-3-141-212-7.us-east-2.compute.amazonaws.com.443 > hubv2-d052a8a7feff0001.lan.45958: Flags [P.], seq 1:48, ack 46, win 21, options [nop,nop,TS val 3549354582 ecr 109092], length 47
13:42:22.173720 IP hubv2-d052a8a7feff0001.lan.45958 > ec2-3-141-212-7.us-east-2.compute.amazonaws.com.443: Flags [.], ack 48, win 2668, options [nop,nop,TS val 109094 ecr 3549354582], length 0
13:42:27.948134 IP ec2-3-141-212-7.us-east-2.compute.amazonaws.com.443 > hubv2-d052a8a7feff0001.lan.45958: Flags [.], ack 46, win 21, options [nop,nop,TS val 3549360356 ecr 109094], length 0
13:42:27.948331 IP hubv2-d052a8a7feff0001.lan.45958 > ec2-3-141-212-7.us-east-2.compute.amazonaws.com.443: Flags [.], ack 48, win 2668, options [nop,nop,TS val 109672 ecr 3549354582], length 0
13:42:48.421927 IP ec2-3-141-212-7.us-east-2.compute.amazonaws.com.443 > hubv2-d052a8a7feff0001.lan.45958: Flags [.], ack 46, win 21, options [nop,nop,TS val 3549380831 ecr 109672], length 0
13:42:48.422126 IP hubv2-d052a8a7feff0001.lan.45958 > ec2-3-141-212-7.us-east-2.compute.amazonaws.com.443: Flags [.], ack 48, win 2668, options [nop,nop,TS val 111719 ecr 3549354582], length 0
13:42:53.155301 IP hubv2-d052a8a7feff0001.lan.45958 > ec2-3-141-212-7.us-east-2.compute.amazonaws.com.443: Flags [P.], seq 46:91, ack 48, win 2668, options [nop,nop,TS val 112193 ecr 3549354582], length 45
13:42:53.182267 IP ec2-3-141-212-7.us-east-2.compute.amazonaws.com.443 > hubv2-d052a8a7feff0001.lan.45958: Flags [P.], seq 48:95, ack 91, win 21, options [nop,nop,TS val 3549385591 ecr 112193], length 47
13:42:53.182489 IP hubv2-d052a8a7feff0001.lan.45958 > ec2-3-141-212-7.us-east-2.compute.amazonaws.com.443: Flags [.], ack 95, win 2668, options [nop,nop,TS val 112195 ecr 3549385591], length 0
13:43:08.906690 IP ec2-3-141-212-7.us-east-2.compute.amazonaws.com.443 > hubv2-d052a8a7feff0001.lan.45958: Flags [.], ack 91, win 21, options [nop,nop,TS val 3549401312 ecr 112195], length 0
13:43:08.906889 IP hubv2-d052a8a7feff0001.lan.45958 > ec2-3-141-212-7.us-east-2.compute.amazonaws.com.443: Flags [.], ack 95, win 2668, options [nop,nop,TS val 113768 ecr 3549385591], length 0
13:43:14.048637 ARP, Request who-has hubv2-d052a8a7feff0001.lan tell OpenWrt.lan, length 28
13:43:14.048815 ARP, Reply hubv2-d052a8a7feff0001.lan is-at d0:52:a8:a7:fe:0c (oui Unknown), length 46
13:43:18.642781 IP hubv2-d052a8a7feff0001.lan.55133 > OpenWrt.lan.53: 11397+ A? fw-update2.smartthings.com. (44)
13:43:18.642782 IP hubv2-d052a8a7feff0001.lan.55133 > OpenWrt.lan.53: 12421+ AAAA? fw-update2.smartthings.com. (44)
13:43:18.655484 IP OpenWrt.lan.53 > hubv2-d052a8a7feff0001.lan.55133: 11397 5/0/0 A 3.86.119.99, A 35.173.146.140, A 52.23.91.236, A 52.205.6.197, A 34.200.5.134 (124)
13:43:18.660348 IP OpenWrt.lan.53 > hubv2-d052a8a7feff0001.lan.55133: 12421 0/1/0 (126)
13:43:18.660985 IP hubv2-d052a8a7feff0001.lan.39234 > ec2-3-86-119-99.compute-1.amazonaws.com.443: Flags [S], seq 3336849516, win 29200, options [mss 1460,sackOK,TS val 114743 ecr 0,nop,wscale 6], length 0
13:43:18.678320 IP ec2-3-86-119-99.compute-1.amazonaws.com.443 > hubv2-d052a8a7feff0001.lan.39234: Flags [S.], seq 2462027762, ack 3336849517, win 26847, options [mss 1460,sackOK,TS val 3228340838 ecr 114743,nop,wscale 12], length 0
13:43:18.678556 IP hubv2-d052a8a7feff0001.lan.39234 > ec2-3-86-119-99.compute-1.amazonaws.com.443: Flags [.], ack 1, win 457, options [nop,nop,TS val 114745 ecr 3228340838], length 0
13:43:18.681310 IP hubv2-d052a8a7feff0001.lan.39234 > ec2-3-86-119-99.compute-1.amazonaws.com.443: Flags [P.], seq 1:294, ack 1, win 457, options [nop,nop,TS val 114745 ecr 3228340838], length 293
13:43:18.697254 IP ec2-3-86-119-99.compute-1.amazonaws.com.443 > hubv2-d052a8a7feff0001.lan.39234: Flags [.], ack 294, win 7, options [nop,nop,TS val 3228340857 ecr 114745], length 0
13:43:18.698255 IP ec2-3-86-119-99.compute-1.amazonaws.com.443 > hubv2-d052a8a7feff0001.lan.39234: Flags [P.], seq 1:97, ack 294, win 7, options [nop,nop,TS val 3228340857 ecr 114745], length 96
13:43:18.699507 IP hubv2-d052a8a7feff0001.lan.39234 > ec2-3-86-119-99.compute-1.amazonaws.com.443: Flags [.], ack 97, win 457, options [nop,nop,TS val 114747 ecr 3228340857], length 0
13:43:18.700010 IP ec2-3-86-119-99.compute-1.amazonaws.com.443 > hubv2-d052a8a7feff0001.lan.39234: Flags [P.], seq 97:1455, ack 294, win 7, options [nop,nop,TS val 3228340857 ecr 114745], length 1358
13:43:18.700377 IP hubv2-d052a8a7feff0001.lan.39234 > ec2-3-86-119-99.compute-1.amazonaws.com.443: Flags [.], ack 1455, win 502, options [nop,nop,TS val 114747 ecr 3228340857], length 0
13:43:18.701127 IP ec2-3-86-119-99.compute-1.amazonaws.com.443 > hubv2-d052a8a7feff0001.lan.39234: Flags [P.], seq 1455:1665, ack 294, win 7, options [nop,nop,TS val 3228340858 ecr 114745], length 210
13:43:18.701344 IP hubv2-d052a8a7feff0001.lan.39234 > ec2-3-86-119-99.compute-1.amazonaws.com.443: Flags [.], ack 1665, win 544, options [nop,nop,TS val 114747 ecr 3228340858], length 0
13:43:18.702156 IP ec2-3-86-119-99.compute-1.amazonaws.com.443 > hubv2-d052a8a7feff0001.lan.39234: Flags [P.], seq 1665:1674, ack 294, win 7, options [nop,nop,TS val 3228340858 ecr 114745], length 9
13:43:18.702346 IP hubv2-d052a8a7feff0001.lan.39234 > ec2-3-86-119-99.compute-1.amazonaws.com.443: Flags [.], ack 1674, win 544, options [nop,nop,TS val 114748 ecr 3228340858], length 0
13:43:18.713934 IP hubv2-d052a8a7feff0001.lan.39234 > ec2-3-86-119-99.compute-1.amazonaws.com.443: Flags [P.], seq 294:420, ack 1674, win 544, options [nop,nop,TS val 114749 ecr 3228340858], length 126
13:43:18.729352 IP ec2-3-86-119-99.compute-1.amazonaws.com.443 > hubv2-d052a8a7feff0001.lan.39234: Flags [.], ack 420, win 7, options [nop,nop,TS val 3228340890 ecr 114749], length 0
13:43:18.730417 IP ec2-3-86-119-99.compute-1.amazonaws.com.443 > hubv2-d052a8a7feff0001.lan.39234: Flags [P.], seq 1674:1793, ack 420, win 7, options [nop,nop,TS val 3228340890 ecr 114749], length 119
13:43:18.731508 IP ec2-3-86-119-99.compute-1.amazonaws.com.443 > hubv2-d052a8a7feff0001.lan.39234: Flags [P.], seq 1793:1844, ack 420, win 7, options [nop,nop,TS val 3228340890 ecr 114749], length 51
13:43:18.731736 IP hubv2-d052a8a7feff0001.lan.39234 > ec2-3-86-119-99.compute-1.amazonaws.com.443: Flags [.], ack 1844, win 544, options [nop,nop,TS val 114750 ecr 3228340890], length 0
13:43:18.732385 IP hubv2-d052a8a7feff0001.lan.39234 > ec2-3-86-119-99.compute-1.amazonaws.com.443: Flags [P.], seq 420:486, ack 1844, win 544, options [nop,nop,TS val 114751 ecr 3228340890], length 66
13:43:18.752648 IP ec2-3-86-119-99.compute-1.amazonaws.com.443 > hubv2-d052a8a7feff0001.lan.39234: Flags [P.], seq 1844:1889, ack 486, win 7, options [nop,nop,TS val 3228340912 ecr 114751], length 45
13:43:18.753169 IP hubv2-d052a8a7feff0001.lan.39234 > ec2-3-86-119-99.compute-1.amazonaws.com.443: Flags [P.], seq 486:566, ack 1889, win 544, options [nop,nop,TS val 114753 ecr 3228340912], length 80
13:43:18.769890 IP ec2-3-86-119-99.compute-1.amazonaws.com.443 > hubv2-d052a8a7feff0001.lan.39234: Flags [P.], seq 1889:1943, ack 566, win 7, options [nop,nop,TS val 3228340929 ecr 114753], length 54
13:43:18.770317 IP hubv2-d052a8a7feff0001.lan.39234 > ec2-3-86-119-99.compute-1.amazonaws.com.443: Flags [P.], seq 566:685, ack 1943, win 544, options [nop,nop,TS val 114754 ecr 3228340929], length 119
13:43:18.786663 IP ec2-3-86-119-99.compute-1.amazonaws.com.443 > hubv2-d052a8a7feff0001.lan.39234: Flags [P.], seq 1943:1980, ack 685, win 7, options [nop,nop,TS val 3228340946 ecr 114754], length 37
13:43:18.787175 IP hubv2-d052a8a7feff0001.lan.39234 > ec2-3-86-119-99.compute-1.amazonaws.com.443: Flags [P.], seq 685:1220, ack 1980, win 544, options [nop,nop,TS val 114756 ecr 3228340946], length 535
13:43:18.800388 IP ec2-3-86-119-99.compute-1.amazonaws.com.443 > hubv2-d052a8a7feff0001.lan.39234: Flags [P.], seq 1980:2055, ack 1220, win 8, options [nop,nop,TS val 3228340962 ecr 114756], length 75
13:43:18.800766 IP hubv2-d052a8a7feff0001.lan.39234 > ec2-3-86-119-99.compute-1.amazonaws.com.443: Flags [F.], seq 1220, ack 2055, win 544, options [nop,nop,TS val 114757 ecr 3228340962], length 0
13:43:18.813991 IP ec2-3-86-119-99.compute-1.amazonaws.com.443 > hubv2-d052a8a7feff0001.lan.39234: Flags [P.], seq 2055:2086, ack 1221, win 8, options [nop,nop,TS val 3228340975 ecr 114757], length 31
13:43:18.814245 IP hubv2-d052a8a7feff0001.lan.39234 > ec2-3-86-119-99.compute-1.amazonaws.com.443: Flags [R], seq 3336850737, win 0, length 0
13:43:18.815202 IP ec2-3-86-119-99.compute-1.amazonaws.com.443 > hubv2-d052a8a7feff0001.lan.39234: Flags [F.], seq 2086, ack 1221, win 8, options [nop,nop,TS val 3228340975 ecr 114757], length 0
13:43:18.815382 IP hubv2-d052a8a7feff0001.lan.39234 > ec2-3-86-119-99.compute-1.amazonaws.com.443: Flags [R], seq 3336850737, win 0, length 0
13:43:20.029556 IP hubv2-d052a8a7feff0001.lan.45309 > OpenWrt.lan.53: 62447+ A? api.smartthings.com. (37)
13:43:20.030870 IP hubv2-d052a8a7feff0001.lan.45309 > OpenWrt.lan.53: 63471+ AAAA? api.smartthings.com. (37)
13:43:20.031775 IP OpenWrt.lan.53 > hubv2-d052a8a7feff0001.lan.45309: 63471 0/0/0 (37)
13:43:20.042736 IP OpenWrt.lan.53 > hubv2-d052a8a7feff0001.lan.45309: 62447 5/0/0 A 54.161.223.90, A 52.205.2.10, A 34.231.181.220, A 34.234.133.142, A 44.194.133.196 (117)
13:43:20.045790 IP hubv2-d052a8a7feff0001.lan.58620 > ec2-54-161-223-90.compute-1.amazonaws.com.443: Flags [S], seq 1536125815, win 29200, options [mss 1460,sackOK,TS val 114882 ecr 0,nop,wscale 6], length 0
13:43:20.062522 IP ec2-54-161-223-90.compute-1.amazonaws.com.443 > hubv2-d052a8a7feff0001.lan.58620: Flags [S.], seq 1097077828, ack 1536125816, win 26847, options [mss 1460,sackOK,TS val 1940338484 ecr 114882,nop,wscale 8], length 0
13:43:20.062777 IP hubv2-d052a8a7feff0001.lan.58620 > ec2-54-161-223-90.compute-1.amazonaws.com.443: Flags [.], ack 1, win 457, options [nop,nop,TS val 114884 ecr 1940338484], length 0
13:43:20.168674 IP hubv2-d052a8a7feff0001.lan.58620 > ec2-54-161-223-90.compute-1.amazonaws.com.443: Flags [P.], seq 1:238, ack 1, win 457, options [nop,nop,TS val 114894 ecr 1940338484], length 237
13:43:20.192770 IP ec2-54-161-223-90.compute-1.amazonaws.com.443 > hubv2-d052a8a7feff0001.lan.58620: Flags [.], ack 238, win 110, options [nop,nop,TS val 1940338614 ecr 114894], length 0
13:43:20.194666 IP ec2-54-161-223-90.compute-1.amazonaws.com.443 > hubv2-d052a8a7feff0001.lan.58620: Flags [.], seq 1:1449, ack 238, win 110, options [nop,nop,TS val 1940338615 ecr 114894], length 1448
13:43:20.194980 IP hubv2-d052a8a7feff0001.lan.58620 > ec2-54-161-223-90.compute-1.amazonaws.com.443: Flags [.], ack 1449, win 502, options [nop,nop,TS val 114897 ecr 1940338615], length 0
13:43:20.196161 IP ec2-54-161-223-90.compute-1.amazonaws.com.443 > hubv2-d052a8a7feff0001.lan.58620: Flags [.], seq 1449:2897, ack 238, win 110, options [nop,nop,TS val 1940338615 ecr 114894], length 1448
13:43:20.196466 IP hubv2-d052a8a7feff0001.lan.58620 > ec2-54-161-223-90.compute-1.amazonaws.com.443: Flags [.], ack 2897, win 547, options [nop,nop,TS val 114897 ecr 1940338615], length 0
13:43:20.197018 IP ec2-54-161-223-90.compute-1.amazonaws.com.443 > hubv2-d052a8a7feff0001.lan.58620: Flags [P.], seq 2897:3315, ack 238, win 110, options [nop,nop,TS val 1940338615 ecr 114894], length 418
13:43:20.197208 IP hubv2-d052a8a7feff0001.lan.58620 > ec2-54-161-223-90.compute-1.amazonaws.com.443: Flags [.], ack 3315, win 592, options [nop,nop,TS val 114897 ecr 1940338615], length 0
13:43:20.206600 IP hubv2-d052a8a7feff0001.lan.58620 > ec2-54-161-223-90.compute-1.amazonaws.com.443: Flags [P.], seq 238:313, ack 3315, win 592, options [nop,nop,TS val 114898 ecr 1940338615], length 75
13:43:20.206858 IP hubv2-d052a8a7feff0001.lan.58620 > ec2-54-161-223-90.compute-1.amazonaws.com.443: Flags [P.], seq 313:319, ack 3315, win 592, options [nop,nop,TS val 114898 ecr 1940338615], length 6
13:43:20.206859 IP hubv2-d052a8a7feff0001.lan.58620 > ec2-54-161-223-90.compute-1.amazonaws.com.443: Flags [P.], seq 319:364, ack 3315, win 592, options [nop,nop,TS val 114898 ecr 1940338615], length 45
13:43:20.226524 IP ec2-54-161-223-90.compute-1.amazonaws.com.443 > hubv2-d052a8a7feff0001.lan.58620: Flags [.], ack 364, win 110, options [nop,nop,TS val 1940338648 ecr 114898], length 0
13:43:20.227507 IP ec2-54-161-223-90.compute-1.amazonaws.com.443 > hubv2-d052a8a7feff0001.lan.58620: Flags [P.], seq 3315:3366, ack 364, win 110, options [nop,nop,TS val 1940338648 ecr 114898], length 51
13:43:20.234538 IP hubv2-d052a8a7feff0001.lan.58620 > ec2-54-161-223-90.compute-1.amazonaws.com.443: Flags [P.], seq 364:495, ack 3366, win 592, options [nop,nop,TS val 114901 ecr 1940338648], length 131
13:43:20.252357 IP ec2-54-161-223-90.compute-1.amazonaws.com.443 > hubv2-d052a8a7feff0001.lan.58620: Flags [P.], seq 3366:3565, ack 495, win 114, options [nop,nop,TS val 1940338673 ecr 114901], length 199
13:43:20.253497 IP hubv2-d052a8a7feff0001.lan.58620 > ec2-54-161-223-90.compute-1.amazonaws.com.443: Flags [P.], seq 495:526, ack 3565, win 638, options [nop,nop,TS val 114903 ecr 1940338673], length 31
13:43:20.263734 IP hubv2-d052a8a7feff0001.lan.58620 > ec2-54-161-223-90.compute-1.amazonaws.com.443: Flags [F.], seq 526, ack 3565, win 638, options [nop,nop,TS val 114904 ecr 1940338673], length 0
13:43:20.269719 IP ec2-54-161-223-90.compute-1.amazonaws.com.443 > hubv2-d052a8a7feff0001.lan.58620: Flags [F.], seq 3565, ack 526, win 114, options [nop,nop,TS val 1940338691 ecr 114903], length 0
13:43:20.269962 IP hubv2-d052a8a7feff0001.lan.58620 > ec2-54-161-223-90.compute-1.amazonaws.com.443: Flags [.], ack 3566, win 638, options [nop,nop,TS val 114904 ecr 1940338691], length 0
13:43:20.279506 IP ec2-54-161-223-90.compute-1.amazonaws.com.443 > hubv2-d052a8a7feff0001.lan.58620: Flags [.], ack 527, win 114, options [nop,nop,TS val 1940338701 ecr 114904], length 0
13:43:24.164318 IP hubv2-d052a8a7feff0001.lan.45958 > ec2-3-141-212-7.us-east-2.compute.amazonaws.com.443: Flags [P.], seq 91:136, ack 95, win 2668, options [nop,nop,TS val 115294 ecr 3549385591], length 45
13:43:24.190842 IP ec2-3-141-212-7.us-east-2.compute.amazonaws.com.443 > hubv2-d052a8a7feff0001.lan.45958: Flags [P.], seq 95:142, ack 136, win 21, options [nop,nop,TS val 3549416599 ecr 115294], length 47
13:43:24.191057 IP hubv2-d052a8a7feff0001.lan.45958 > ec2-3-141-212-7.us-east-2.compute.amazonaws.com.443: Flags [.], ack 142, win 2668, options [nop,nop,TS val 115296 ecr 3549416599], length 0
13:43:29.382361 IP ec2-3-141-212-7.us-east-2.compute.amazonaws.com.443 > hubv2-d052a8a7feff0001.lan.45958: Flags [.], ack 136, win 21, options [nop,nop,TS val 3549421791 ecr 115296], length 0
13:43:29.382558 IP hubv2-d052a8a7feff0001.lan.45958 > ec2-3-141-212-7.us-east-2.compute.amazonaws.com.443: Flags [.], ack 142, win 2668, options [nop,nop,TS val 115816 ecr 3549416599], length 0
13:43:49.866108 IP ec2-3-141-212-7.us-east-2.compute.amazonaws.com.443 > hubv2-d052a8a7feff0001.lan.45958: Flags [.], ack 136, win 21, options [nop,nop,TS val 3549442272 ecr 115816], length 0
13:43:49.866316 IP hubv2-d052a8a7feff0001.lan.45958 > ec2-3-141-212-7.us-east-2.compute.amazonaws.com.443: Flags [.], ack 142, win 2668, options [nop,nop,TS val 117864 ecr 3549416599], length 0
13:43:55.008638 ARP, Request who-has hubv2-d052a8a7feff0001.lan tell OpenWrt.lan, length 28
13:43:55.008816 ARP, Reply hubv2-d052a8a7feff0001.lan is-at d0:52:a8:a7:fe:0c (oui Unknown), length 46
13:43:55.173010 IP hubv2-d052a8a7feff0001.lan.45958 > ec2-3-141-212-7.us-east-2.compute.amazonaws.com.443: Flags [P.], seq 136:181, ack 142, win 2668, options [nop,nop,TS val 118395 ecr 3549416599], length 45
13:43:55.199591 IP ec2-3-141-212-7.us-east-2.compute.amazonaws.com.443 > hubv2-d052a8a7feff0001.lan.45958: Flags [P.], seq 142:189, ack 181, win 21, options [nop,nop,TS val 3549447609 ecr 118395], length 47
13:43:55.199806 IP hubv2-d052a8a7feff0001.lan.45958 > ec2-3-141-212-7.us-east-2.compute.amazonaws.com.443: Flags [.], ack 189, win 2668, options [nop,nop,TS val 118397 ecr 3549447609], length 0
13:44:10.342950 IP ec2-3-141-212-7.us-east-2.compute.amazonaws.com.443 > hubv2-d052a8a7feff0001.lan.45958: Flags [.], ack 181, win 21, options [nop,nop,TS val 3549462751 ecr 118397], length 0
13:44:10.343164 IP hubv2-d052a8a7feff0001.lan.45958 > ec2-3-141-212-7.us-east-2.compute.amazonaws.com.443: Flags [.], ack 189, win 2668, options [nop,nop,TS val 119912 ecr 3549447609], length 0
13:44:19.150429 IP hubv2-d052a8a7feff0001.lan.45958 > ec2-3-141-212-7.us-east-2.compute.amazonaws.com.443: Flags [P.], seq 181:230, ack 189, win 2668, options [nop,nop,TS val 120793 ecr 3549447609], length 49
13:44:19.176915 IP ec2-3-141-212-7.us-east-2.compute.amazonaws.com.443 > hubv2-d052a8a7feff0001.lan.45958: Flags [P.], seq 189:244, ack 230, win 21, options [nop,nop,TS val 3549471586 ecr 120793], length 55
13:44:19.177138 IP hubv2-d052a8a7feff0001.lan.45958 > ec2-3-141-212-7.us-east-2.compute.amazonaws.com.443: Flags [.], ack 244, win 2668, options [nop,nop,TS val 120795 ecr 3549471586], length 0
13:44:20.011250 IP hubv2-d052a8a7feff0001.lan.50085 > OpenWrt.lan.53: 23533+ A? api.smartthings.com. (37)
13:44:20.013679 IP hubv2-d052a8a7feff0001.lan.50085 > OpenWrt.lan.53: 25069+ AAAA? api.smartthings.com. (37)
13:44:20.014359 IP OpenWrt.lan.53 > hubv2-d052a8a7feff0001.lan.50085: 25069 0/0/0 (37)
13:44:20.024904 IP OpenWrt.lan.53 > hubv2-d052a8a7feff0001.lan.50085: 23533 5/0/0 A 34.231.181.220, A 52.205.2.10, A 44.194.133.196, A 54.161.223.90, A 34.234.133.142 (117)
13:44:20.027831 IP hubv2-d052a8a7feff0001.lan.33878 > ec2-34-231-181-220.compute-1.amazonaws.com.443: Flags [S], seq 516860384, win 29200, options [mss 1460,sackOK,TS val 120880 ecr 0,nop,wscale 6], length 0
13:44:20.044526 IP ec2-34-231-181-220.compute-1.amazonaws.com.443 > hubv2-d052a8a7feff0001.lan.33878: Flags [S.], seq 3685277000, ack 516860385, win 26847, options [mss 1460,sackOK,TS val 3305756192 ecr 120880,nop,wscale 8], length 0
13:44:20.047206 IP hubv2-d052a8a7feff0001.lan.33878 > ec2-34-231-181-220.compute-1.amazonaws.com.443: Flags [.], ack 1, win 457, options [nop,nop,TS val 120882 ecr 3305756192], length 0
13:44:20.152034 IP hubv2-d052a8a7feff0001.lan.33878 > ec2-34-231-181-220.compute-1.amazonaws.com.443: Flags [P.], seq 1:238, ack 1, win 457, options [nop,nop,TS val 120893 ecr 3305756192], length 237
13:44:20.168586 IP ec2-34-231-181-220.compute-1.amazonaws.com.443 > hubv2-d052a8a7feff0001.lan.33878: Flags [.], ack 238, win 110, options [nop,nop,TS val 3305756316 ecr 120893], length 0
13:44:20.170135 IP ec2-34-231-181-220.compute-1.amazonaws.com.443 > hubv2-d052a8a7feff0001.lan.33878: Flags [.], seq 1:1449, ack 238, win 110, options [nop,nop,TS val 3305756317 ecr 120893], length 1448
13:44:20.170444 IP hubv2-d052a8a7feff0001.lan.33878 > ec2-34-231-181-220.compute-1.amazonaws.com.443: Flags [.], ack 1449, win 502, options [nop,nop,TS val 120895 ecr 3305756317], length 0
13:44:20.171823 IP ec2-34-231-181-220.compute-1.amazonaws.com.443 > hubv2-d052a8a7feff0001.lan.33878: Flags [.], seq 1449:2897, ack 238, win 110, options [nop,nop,TS val 3305756317 ecr 120893], length 1448
13:44:20.172167 IP hubv2-d052a8a7feff0001.lan.33878 > ec2-34-231-181-220.compute-1.amazonaws.com.443: Flags [.], ack 2897, win 547, options [nop,nop,TS val 120895 ecr 3305756317], length 0
13:44:20.172698 IP ec2-34-231-181-220.compute-1.amazonaws.com.443 > hubv2-d052a8a7feff0001.lan.33878: Flags [P.], seq 2897:3315, ack 238, win 110, options [nop,nop,TS val 3305756317 ecr 120893], length 418
13:44:20.172932 IP hubv2-d052a8a7feff0001.lan.33878 > ec2-34-231-181-220.compute-1.amazonaws.com.443: Flags [.], ack 3315, win 592, options [nop,nop,TS val 120895 ecr 3305756317], length 0
13:44:20.182545 IP hubv2-d052a8a7feff0001.lan.33878 > ec2-34-231-181-220.compute-1.amazonaws.com.443: Flags [P.], seq 238:313, ack 3315, win 592, options [nop,nop,TS val 120896 ecr 3305756317], length 75
13:44:20.182782 IP hubv2-d052a8a7feff0001.lan.33878 > ec2-34-231-181-220.compute-1.amazonaws.com.443: Flags [P.], seq 313:319, ack 3315, win 592, options [nop,nop,TS val 120896 ecr 3305756317], length 6
13:44:20.182783 IP hubv2-d052a8a7feff0001.lan.33878 > ec2-34-231-181-220.compute-1.amazonaws.com.443: Flags [P.], seq 319:364, ack 3315, win 592, options [nop,nop,TS val 120896 ecr 3305756317], length 45
13:44:20.201827 IP ec2-34-231-181-220.compute-1.amazonaws.com.443 > hubv2-d052a8a7feff0001.lan.33878: Flags [.], ack 364, win 110, options [nop,nop,TS val 3305756349 ecr 120896], length 0
13:44:20.202831 IP ec2-34-231-181-220.compute-1.amazonaws.com.443 > hubv2-d052a8a7feff0001.lan.33878: Flags [P.], seq 3315:3366, ack 364, win 110, options [nop,nop,TS val 3305756349 ecr 120896], length 51
13:44:20.209609 IP hubv2-d052a8a7feff0001.lan.33878 > ec2-34-231-181-220.compute-1.amazonaws.com.443: Flags [P.], seq 364:495, ack 3366, win 592, options [nop,nop,TS val 120898 ecr 3305756349], length 131
13:44:20.224987 IP ec2-34-231-181-220.compute-1.amazonaws.com.443 > hubv2-d052a8a7feff0001.lan.33878: Flags [P.], seq 3366:3565, ack 495, win 114, options [nop,nop,TS val 3305756372 ecr 120898], length 199
13:44:20.226006 IP hubv2-d052a8a7feff0001.lan.33878 > ec2-34-231-181-220.compute-1.amazonaws.com.443: Flags [P.], seq 495:526, ack 3565, win 638, options [nop,nop,TS val 120900 ecr 3305756372], length 31
13:44:20.235820 IP hubv2-d052a8a7feff0001.lan.33878 > ec2-34-231-181-220.compute-1.amazonaws.com.443: Flags [F.], seq 526, ack 3565, win 638, options [nop,nop,TS val 120901 ecr 3305756372], length 0
13:44:20.240507 IP ec2-34-231-181-220.compute-1.amazonaws.com.443 > hubv2-d052a8a7feff0001.lan.33878: Flags [F.], seq 3565, ack 526, win 114, options [nop,nop,TS val 3305756387 ecr 120900], length 0
13:44:20.241581 IP hubv2-d052a8a7feff0001.lan.33878 > ec2-34-231-181-220.compute-1.amazonaws.com.443: Flags [.], ack 3566, win 638, options [nop,nop,TS val 120902 ecr 3305756387], length 0
13:44:20.261385 IP ec2-34-231-181-220.compute-1.amazonaws.com.443 > hubv2-d052a8a7feff0001.lan.33878: Flags [.], ack 527, win 114, options [nop,nop,TS val 3305756398 ecr 120901], length 0
13:44:30.824696 IP ec2-3-141-212-7.us-east-2.compute.amazonaws.com.443 > hubv2-d052a8a7feff0001.lan.45958: Flags [.], ack 230, win 21, options [nop,nop,TS val 3549483232 ecr 120795], length 0
13:44:30.824908 IP hubv2-d052a8a7feff0001.lan.45958 > ec2-3-141-212-7.us-east-2.compute.amazonaws.com.443: Flags [.], ack 244, win 2668, options [nop,nop,TS val 121960 ecr 3549471586], length 0
13:44:35.968640 ARP, Request who-has hubv2-d052a8a7feff0001.lan tell OpenWrt.lan, length 28
13:44:35.969024 ARP, Reply hubv2-d052a8a7feff0001.lan is-at d0:52:a8:a7:fe:0c (oui Unknown), length 46
13:44:40.229935 IP hubv2-d052a8a7feff0001.lan.48278 > OpenWrt.lan.53: 46425+ A? api.smartthings.com. (37)
13:44:40.233026 IP OpenWrt.lan.53 > hubv2-d052a8a7feff0001.lan.48278: 46425 5/0/0 A 34.231.181.220, A 34.234.133.142, A 54.161.223.90, A 44.194.133.196, A 52.205.2.10 (117)
13:44:40.234842 IP hubv2-d052a8a7feff0001.lan.45690 > ec2-34-234-133-142.compute-1.amazonaws.com.443: Flags [S], seq 1442741993, win 29200, options [mss 1460,sackOK,TS val 122900 ecr 0,nop,wscale 6], length 0
13:44:40.251526 IP ec2-34-234-133-142.compute-1.amazonaws.com.443 > hubv2-d052a8a7feff0001.lan.45690: Flags [S.], seq 1326283230, ack 1442741994, win 26847, options [mss 1460,sackOK,TS val 4232764984 ecr 122900,nop,wscale 8], length 0
13:44:40.251767 IP hubv2-d052a8a7feff0001.lan.45690 > ec2-34-234-133-142.compute-1.amazonaws.com.443: Flags [.], ack 1, win 457, options [nop,nop,TS val 122902 ecr 4232764984], length 0
13:44:40.252110 IP hubv2-d052a8a7feff0001.lan.45690 > ec2-34-234-133-142.compute-1.amazonaws.com.443: Flags [P.], seq 1:121, ack 1, win 457, options [nop,nop,TS val 122902 ecr 4232764984], length 120
13:44:40.272694 IP ec2-34-234-133-142.compute-1.amazonaws.com.443 > hubv2-d052a8a7feff0001.lan.45690: Flags [.], ack 121, win 105, options [nop,nop,TS val 4232765004 ecr 122902], length 0
13:44:40.273434 IP ec2-34-234-133-142.compute-1.amazonaws.com.443 > hubv2-d052a8a7feff0001.lan.45690: Flags [R.], seq 1, ack 121, win 105, options [nop,nop,TS val 4232765004 ecr 122902], length 0
13:44:50.195069 IP hubv2-d052a8a7feff0001.lan.45958 > ec2-3-141-212-7.us-east-2.compute.amazonaws.com.443: Flags [P.], seq 230:275, ack 244, win 2668, options [nop,nop,TS val 123893 ecr 3549471586], length 45
13:44:50.252219 IP ec2-3-141-212-7.us-east-2.compute.amazonaws.com.443 > hubv2-d052a8a7feff0001.lan.45958: Flags [P.], seq 244:291, ack 275, win 21, options [nop,nop,TS val 3549502633 ecr 123893], length 47
13:44:50.267105 IP hubv2-d052a8a7feff0001.lan.45958 > ec2-3-141-212-7.us-east-2.compute.amazonaws.com.443: Flags [.], ack 291, win 2668, options [nop,nop,TS val 123902 ecr 3549502633], length 0
13:44:51.373676 IP ec2-3-141-212-7.us-east-2.compute.amazonaws.com.443 > hubv2-d052a8a7feff0001.lan.45958: Flags [.], ack 275, win 21, options [nop,nop,TS val 3549503715 ecr 123902], length 0
13:44:51.417471 IP hubv2-d052a8a7feff0001.lan.45958 > ec2-3-141-212-7.us-east-2.compute.amazonaws.com.443: Flags [.], ack 291, win 2668, options [nop,nop,TS val 124014 ecr 3549502633], length 0
13:45:09.087576 IP hubv2-d052a8a7feff0001.lan.45958 > ec2-3-141-212-7.us-east-2.compute.amazonaws.com.443: Flags [P.], seq 275:421, ack 291, win 2668, options [nop,nop,TS val 125786 ecr 3549502633], length 146
13:45:09.160745 IP ec2-3-141-212-7.us-east-2.compute.amazonaws.com.443 > hubv2-d052a8a7feff0001.lan.45958: Flags [.], ack 421, win 22, options [nop,nop,TS val 3549521570 ecr 125786], length 0
13:45:11.794258 IP ec2-3-141-212-7.us-east-2.compute.amazonaws.com.443 > hubv2-d052a8a7feff0001.lan.45958: Flags [.], ack 421, win 22, options [nop,nop,TS val 3549524192 ecr 125786], length 0
13:45:11.794455 IP hubv2-d052a8a7feff0001.lan.45958 > ec2-3-141-212-7.us-east-2.compute.amazonaws.com.443: Flags [.], ack 291, win 2668, options [nop,nop,TS val 126056 ecr 3549521570], length 0
13:45:14.368638 ARP, Request who-has hubv2-d052a8a7feff0001.lan tell OpenWrt.lan, length 28
13:45:14.368978 ARP, Reply hubv2-d052a8a7feff0001.lan is-at d0:52:a8:a7:fe:0c (oui Unknown), length 46
13:45:20.077452 IP hubv2-d052a8a7feff0001.lan.51572 > OpenWrt.lan.53: 54707+ A? api.smartthings.com. (37)
13:45:20.078579 IP hubv2-d052a8a7feff0001.lan.51572 > OpenWrt.lan.53: 56243+ AAAA? api.smartthings.com. (37)
13:45:20.079083 IP OpenWrt.lan.53 > hubv2-d052a8a7feff0001.lan.51572: 56243 0/0/0 (37)
13:45:20.090038 IP OpenWrt.lan.53 > hubv2-d052a8a7feff0001.lan.51572: 54707 5/0/0 A 52.205.2.10, A 34.234.133.142, A 54.161.223.90, A 44.194.133.196, A 34.231.181.220 (117)
13:45:20.093116 IP hubv2-d052a8a7feff0001.lan.50124 > ec2-52-205-2-10.compute-1.amazonaws.com.443: Flags [S], seq 3275026025, win 29200, options [mss 1460,sackOK,TS val 126886 ecr 0,nop,wscale 6], length 0
13:45:20.110496 IP ec2-52-205-2-10.compute-1.amazonaws.com.443 > hubv2-d052a8a7feff0001.lan.50124: Flags [S.], seq 2347150009, ack 3275026026, win 26847, options [mss 1460,sackOK,TS val 2811295901 ecr 126886,nop,wscale 8], length 0
13:45:20.113343 IP hubv2-d052a8a7feff0001.lan.50124 > ec2-52-205-2-10.compute-1.amazonaws.com.443: Flags [.], ack 1, win 457, options [nop,nop,TS val 126888 ecr 2811295901], length 0
13:45:20.224747 IP hubv2-d052a8a7feff0001.lan.50124 > ec2-52-205-2-10.compute-1.amazonaws.com.443: Flags [P.], seq 1:238, ack 1, win 457, options [nop,nop,TS val 126899 ecr 2811295901], length 237
13:45:20.243577 IP ec2-52-205-2-10.compute-1.amazonaws.com.443 > hubv2-d052a8a7feff0001.lan.50124: Flags [.], ack 238, win 110, options [nop,nop,TS val 2811296034 ecr 126899], length 0
13:45:20.245139 IP ec2-52-205-2-10.compute-1.amazonaws.com.443 > hubv2-d052a8a7feff0001.lan.50124: Flags [.], seq 1:1449, ack 238, win 110, options [nop,nop,TS val 2811296035 ecr 126899], length 1448
13:45:20.245444 IP hubv2-d052a8a7feff0001.lan.50124 > ec2-52-205-2-10.compute-1.amazonaws.com.443: Flags [.], ack 1449, win 502, options [nop,nop,TS val 126901 ecr 2811296035], length 0
13:45:20.246584 IP ec2-52-205-2-10.compute-1.amazonaws.com.443 > hubv2-d052a8a7feff0001.lan.50124: Flags [.], seq 1449:2897, ack 238, win 110, options [nop,nop,TS val 2811296035 ecr 126899], length 1448
13:45:20.246904 IP hubv2-d052a8a7feff0001.lan.50124 > ec2-52-205-2-10.compute-1.amazonaws.com.443: Flags [.], ack 2897, win 547, options [nop,nop,TS val 126902 ecr 2811296035], length 0
13:45:20.247522 IP ec2-52-205-2-10.compute-1.amazonaws.com.443 > hubv2-d052a8a7feff0001.lan.50124: Flags [P.], seq 2897:3315, ack 238, win 110, options [nop,nop,TS val 2811296035 ecr 126899], length 418
13:45:20.247736 IP hubv2-d052a8a7feff0001.lan.50124 > ec2-52-205-2-10.compute-1.amazonaws.com.443: Flags [.], ack 3315, win 592, options [nop,nop,TS val 126902 ecr 2811296035], length 0
13:45:20.264431 IP hubv2-d052a8a7feff0001.lan.50124 > ec2-52-205-2-10.compute-1.amazonaws.com.443: Flags [P.], seq 238:313, ack 3315, win 592, options [nop,nop,TS val 126903 ecr 2811296035], length 75
13:45:20.264765 IP hubv2-d052a8a7feff0001.lan.50124 > ec2-52-205-2-10.compute-1.amazonaws.com.443: Flags [P.], seq 313:319, ack 3315, win 592, options [nop,nop,TS val 126903 ecr 2811296035], length 6
13:45:20.264766 IP hubv2-d052a8a7feff0001.lan.50124 > ec2-52-205-2-10.compute-1.amazonaws.com.443: Flags [P.], seq 319:364, ack 3315, win 592, options [nop,nop,TS val 126903 ecr 2811296035], length 45
13:45:20.281908 IP ec2-52-205-2-10.compute-1.amazonaws.com.443 > hubv2-d052a8a7feff0001.lan.50124: Flags [.], ack 364, win 110, options [nop,nop,TS val 2811296072 ecr 126903], length 0
13:45:20.283332 IP ec2-52-205-2-10.compute-1.amazonaws.com.443 > hubv2-d052a8a7feff0001.lan.50124: Flags [P.], seq 3315:3366, ack 364, win 110, options [nop,nop,TS val 2811296073 ecr 126903], length 51
13:45:20.291651 IP hubv2-d052a8a7feff0001.lan.50124 > ec2-52-205-2-10.compute-1.amazonaws.com.443: Flags [P.], seq 364:495, ack 3366, win 592, options [nop,nop,TS val 126906 ecr 2811296073], length 131
13:45:20.307188 IP ec2-52-205-2-10.compute-1.amazonaws.com.443 > hubv2-d052a8a7feff0001.lan.50124: Flags [P.], seq 3366:3565, ack 495, win 114, options [nop,nop,TS val 2811296097 ecr 126906], length 199
13:45:20.308304 IP hubv2-d052a8a7feff0001.lan.50124 > ec2-52-205-2-10.compute-1.amazonaws.com.443: Flags [P.], seq 495:526, ack 3565, win 638, options [nop,nop,TS val 126908 ecr 2811296097], length 31
13:45:20.318364 IP hubv2-d052a8a7feff0001.lan.50124 > ec2-52-205-2-10.compute-1.amazonaws.com.443: Flags [F.], seq 526, ack 3565, win 638, options [nop,nop,TS val 126909 ecr 2811296097], length 0
13:45:20.324616 IP ec2-52-205-2-10.compute-1.amazonaws.com.443 > hubv2-d052a8a7feff0001.lan.50124: Flags [F.], seq 3565, ack 526, win 114, options [nop,nop,TS val 2811296115 ecr 126908], length 0
13:45:20.324857 IP hubv2-d052a8a7feff0001.lan.50124 > ec2-52-205-2-10.compute-1.amazonaws.com.443: Flags [.], ack 3566, win 638, options [nop,nop,TS val 126909 ecr 2811296115], length 0
13:45:20.333709 IP ec2-52-205-2-10.compute-1.amazonaws.com.443 > hubv2-d052a8a7feff0001.lan.50124: Flags [.], ack 527, win 114, options [nop,nop,TS val 2811296124 ecr 126909], length 0
13:45:32.262964 IP ec2-3-141-212-7.us-east-2.compute.amazonaws.com.443 > hubv2-d052a8a7feff0001.lan.45958: Flags [.], ack 421, win 22, options [nop,nop,TS val 3549544672 ecr 126056], length 0
13:45:32.263158 IP hubv2-d052a8a7feff0001.lan.45958 > ec2-3-141-212-7.us-east-2.compute.amazonaws.com.443: Flags [.], ack 291, win 2668, options [nop,nop,TS val 128103 ecr 3549521570], length 0
13:45:40.086458 IP hubv2-d052a8a7feff0001.lan.45958 > ec2-3-141-212-7.us-east-2.compute.amazonaws.com.443: Flags [P.], seq 421:466, ack 291, win 2668, options [nop,nop,TS val 128886 ecr 3549521570], length 45
13:45:40.111526 IP ec2-3-141-212-7.us-east-2.compute.amazonaws.com.443 > hubv2-d052a8a7feff0001.lan.45958: Flags [.], ack 466, win 22, options [nop,nop,TS val 3549552521 ecr 128886], length 0
13:45:40.113020 IP ec2-3-141-212-7.us-east-2.compute.amazonaws.com.443 > hubv2-d052a8a7feff0001.lan.45958: Flags [P.], seq 291:338, ack 466, win 22, options [nop,nop,TS val 3549552522 ecr 128886], length 47
13:45:40.113171 IP hubv2-d052a8a7feff0001.lan.45958 > ec2-3-141-212-7.us-east-2.compute.amazonaws.com.443: Flags [.], ack 338, win 2668, options [nop,nop,TS val 128888 ecr 3549552522], length 0
13:45:52.746060 IP ec2-3-141-212-7.us-east-2.compute.amazonaws.com.443 > hubv2-d052a8a7feff0001.lan.45958: Flags [.], ack 466, win 22, options [nop,nop,TS val 3549565152 ecr 128888], length 0
